评分,用户,评论详情,日期,IP位置
5分 超棒,见花花,"六盘水本来就很凉快了，结果乌蒙大草原更舒服，居然夏天温度可以只有11度。对于来自40度的我们，简直到了天堂。
乌蒙大草原属于高山草甸，这里牛羊成群，绿草如茵，野花遍地，景色非常漂亮。游客中心附近民宿便宜，许多外地人在此避暑常住，包吃住又不贵又凉快，真的非常好。我喜欢。",2021-09-17,IP属地：未知
5分 超棒,Littlefederer,"乌蒙大草原位于六盘水市，距离盘州市和六盘水市区车程大概都在一小时左右，全程路况非常的好，山脚下的小镇和山顶上都很方便停车，非常适合自驾游。
景色非常美，尤其适合在夏秋之际，天气晴朗之时前往，山顶很平坦，有巨大的高山草甸，还有三处高山湖泊，仿若明珠。沿着山脊线上排布着许多风力发电机，人与自然的景观和谐统一。
山脚下有小镇，小镇上住宿饮食都很方便。山顶上也有不少住的地方，有集装箱改造的特色酒店、位于悬崖附近可观日出日落的民宿、还有房车营地。
景区非常大，自驾游也需要大概一天的时间才能把每个景点都看到，光是步行栈道就有十几公里长，但是值得花时间走走看看，非常美丽。
草原一年四季都可以玩，春季清明前后可以看杜鹃花海、夏季可以看绿草茵茵、秋季可以看山间层林尽染、冬季可以看银装素裹，草原上还有两个滑雪场，适合喜好滑雪的朋友。
景区门票也很便宜，现在半票，一辆车只要30元的环保费即可上山。
性价比非常高，景色非常美，交通非常方便，是个值得一去的景点。",2020-12-06,IP属地：未知
5分 超棒,_M15****4215,非常棒的景点，可以开车进，高山草原，山路修得很好。有点像内蒙，边开车边玩，有出国玩的感觉，景点旁停车，下车就可以玩，空中玻璃滑道漂流好玩，可以骑马，放风筝，看佛光（我们去的两天天晴无云，没看到），晚上住的房车有点特色，不过设施简陋了点。这里不像国内大部分的景点，在大门口就关闸，不给车进，收电瓶车费，景点交通车费，然后去排队挤车，风景再好也不想去。,2020-08-30,IP属地：未知
5分 超棒,Lxy60,到中国凉都六盘水避暑，顺便到了西南地区海拔最高，面积最大的草原乌蒙大草原，草原上牛羊成群，绿油油的牧草长势喜人，站在草原上一眼望去，辽阔草原看不到边际，草原上起伏的地貌，在阳光的照射下，好似万顷碧波，非常壮观！,2019-08-07,IP属地：未知
5分 超棒,吃货狗蛋,"景区部分景色非常漂亮，中秋节9月24当天去的几乎没什么人也不堵车，下高速那个地方确实只有一个收费口。景区游玩设施少，但是自然风光绝佳，温度比平原低8度左右，一定要带厚衣服备用。出太阳的时候会更漂亮，我们从上午十点进景区，下午七点离开景区，大多时候天都是灰蒙蒙的。

【入口】高速公路下车后，还要开车好几公里才到景区游客中心，买完票上山有检票口，车辆可以进入。
【景点】景区内有天池、杜鹃花海、佛光观测、滑雪滑草等。各个景点之前距离比较远，靠走路是不可能的，要么自驾、要么包车，观光车不知道能不能随便停。

天池：景色很一般，检票进入景区后第一个遇到的小池塘，可以到池塘旁边爬山。

滑雪滑草：雪场好像歇业冬天开业，滑草没看到在哪里。跟佛光、百草坪等景点方向不一样。

杜鹃花海：只有春天才能看到花，其它时间去只有绿草不具有观赏性。

佛光：有很多个观测点，位置都不一样，最惊艳的是经过天池、艾蒙酒店后的最后一个佛光观测点，草地平缓，视野开阔，景色非常漂亮。可以放风筝等等。山上的玩具都比较贵，风筝25，泡泡玩具15一个。

其它：其实最漂亮的景色还是在路上，越往山顶走，平缓的草地就越多，山下的草地太陡峭了不适合玩耍，只能爬山。牛羊成群，天气晴朗的话配上蓝天白云，心情瞬间大好。

【饮食】景区内吃的不是很多，价格能接受，我们吃的那家烤全羊味道不是很好，农户自己做的，比不得外面餐馆吃。景区门口也有很多餐饮店。

整体评价：一定要自己开车去，山上没什么玩的设施，所以很多人觉得无聊。但是你可以自己组织做游戏、放风筝、草上瞎跑跑，【多带点吃的不要乱扔垃圾，好的环境靠大家维护】，这里适合喜欢自然风光的朋友。反正我是爱死那里了哈哈。",2018-09-25,IP属地：未知
5分 超棒,M40****223,就是看运气了，我们去时有阵雨天气不怎么好，因为快五点了，到了那里直接去了最高点观佛台那里，上去了一片大雾也来了，什么都看不到了，游客些分分都走了，我心里祈祷在想上天啊让雾散了吧我们看可能什么都看不到了，正准备下去时雾突然让风吹开了，点点蔚蓝一片晴朗天空，我们兴奋不已大叫起来，跟着一片美景呈现在眼前，美极了！迎接了夕阳西下！,2018-08-19,IP属地：未知
5分 超棒,古言新语,♬ ♬ ♬ ♬ 《七律。乌蒙山大草原避暑》♬ ♬ ♬ ♬ ♬ 乌蒙草海百花俏，绿野青山鼎九霄。矮马牛羊游牧地，高原荡漾信天谣。坪坡万亩骑骏马，漫步观花野趣饶。日月同辉云海绣，清心避暑好逍遥。,2018-07-15,IP属地：未知
5分 超棒,与神同行abc,"乌蒙大草原一望无际，草色连天，仿佛一片绿色的海洋。站在高处望去，绵延起伏的山峦在云雾间若隐若现，牛羊悠闲地散布在草场上，画面宁静又壮美。清晨时，云海翻腾，日出缓缓洒下金色的光辉，让整个草原都染上一层梦幻的色彩。

骑马驰骋在广阔的草原上，耳边是呼啸的风声，脚下是柔软的青草，那种自由感让人心跳加快。夜晚的星空同样震撼，没有光污染，银河清晰可见，仿佛伸手就能触碰到星辰。坐在篝火旁，听着牧民唱歌，喝上一碗热腾腾的奶茶，才真正体会到草原生活的惬意和浪漫。",2025-04-02,IP属地：贵州
5分 超棒,M36****659,沿着山路一直向上开，到达乌蒙大草原，看到游人扎堆的地方不要停，一直开到尽头远离人群，在故艾蒙帐篷营地附近，才看到最美的风景，这里的草场质量和风景稍逊色于川西和甘肃，整体缺少一种“翠“，但一架架大风车也是别样景致，乌蒙大草原一路可以开车游览，就是雾太大，能见度太低，栈道修的挺好的，就是没有雾肯定更不错。路边卖的羊肉串也好吃，值得一来。,2019-07-13,IP属地：未知
5分 超棒,晓鸣祥铃,乌蒙大草原位于盘州市乌蒙镇与坪地彝族乡境内，海拔2000米至2857米，是西南地区面积最大、海拔最高的天然高原草场之一。年平均气温为11.1℃，是一个夏日避暑同时也是度假休闲的好地方：来这里和绿草相依、和牛羊为伴、放松自我、沐浴阳光、自由呼吸清新的空气。。。来这里也许可以找到你想要的简简单单的生活。,2021-08-18,IP属地：未知
5分 超棒,匿名用户,"这个景区票价很便宜，好像是10块钱左右，而且全景区可以自驾，玩到哪里就把车开到哪里，这对于有老人小孩的出行组合非常适合。整个山很大，有很多牛羊
马在山上吃草、放风。可以去骑马，有很多山民自己营业，价格可以讨价还价，路程也可以选择。有大风车很漂亮，蓝天白云衬托下，拍照也会很漂亮。山上紫外线强烈，需要做好防晒。但是风很大，凉爽。",2024-06-16,IP属地：四川
5分 超棒,瑶啊瑶1014,乌蒙大草原，门票30元，我觉得是十分良心，性价比很高的景点了！可以自己开车一路游玩，不累，风景也不错，但是天气变化很大很快，直接影响观景效果。唯一让我不满的是，这么大的景区，购票处的工作效率太低了，网上买的票还得先做实名登记，拿号，再去排队取票，从头到尾没有任何人和提示牌提示我们流程，也没有机器兑票，排到了才喊我去下面登记拿号，而且进去之前我也先问了工作人员，她也只是不耐烦的说上面取票！太耽误时间了，希望能提高服务质量！,2022-07-19,IP属地：未知
5分 超棒,able,与其说是草原，不如说是高山牧场，私家车能开进景区，有利有弊，好的是可以在景区里面自由自在的徜徉，弊端是没有多少临时停车场，车辆一多，沿路停放，造成了交通拥堵。风景挺赞的，天空蓝蓝，白云悠悠，青草茵茵，成群结队的牛马羊，一架架发电风车随风旋转……里面的恐龙乐园不要进去，门票50，就看了数十只塑料恐龙。,2021-05-14,IP属地：未知
5分 超棒,未末旅记、,"性价比高，景色不错，这是一篇一个多月后的文章，并没有打算写发布的，我去的时候已经是11月份中旬的时候了，那时候草原上已经没有多多的草毕竟是冬天了，但是拍出来也是足够让人家知道是草原的地方了
1、关于交通方面：我强烈推荐
	
一定要自驾，一定要自驾来！不要听别的红书推荐说什么建议自驾，你真不自驾来会后悔的走死你而且太不方便了 打车也是打不到的，我就在周边100公里的地方，发布了二天顺风车没有人接单，打的大概480多，我选择包车去的，和朋友3个人分下来也就166一个人，500一辆司机陪一天司机人挺好的，朋友介绍的名片去问的开始600后来一直谈杀价到500成交，下了高速后就是围着山上去绕从底绕到最上面盘山公路，绕啊绕啊绕绕绕，晕车的人就彻底完蛋了！做好和我一样晕吐的准备吧，太晃绕折腾人了，一定备好凉药去闻会很难受的、
2、现在景区不要门票免费的，但是呢？比较多此一举的就是网上预约了还得到底下的服务站去拿身份证取票不然不给进，所以这点还是很多此一举的，希望官方改进吧，服务站前面就有买风筝帽子等的啊婆也不贵 但是还是要记得啥价但也别太多毕竟人家卖的真也挺优惠了，山上风超级大放风筝的好去处可以",2020-12-09,IP属地：未知
5分 超棒,M36****104,我们是从红果镇出发开车去乌蒙大草原的，从下了高速开始我越来越后悔来这里，主要因为都是山路，急弯很多，都是爬坡路，路况又不太好，挨着山，水城又刚发生了泥石流灾害，我害怕出意外，在老公的坚持下，弯弯曲曲跋山涉水，终于到了，景色真的美极了！贵州省外的游客凭身份证可以买半价票，每人15元，性价比超高！14岁以下的孩子不要票！赞！体验了骑马！,2019-07-25,IP属地：未知
3分 不错,M53****797,"我们一行人是8月份去的。先从高速路收费站说起，乌蒙大草原下道口是在盘县雨格收费站，下道车辆排起至少2公里长龙（就开放了1个闸道口，也许是故意做给有关部门看的吧，好争取资金扩建收费站），还好我们一行12人都肾好，等了约40多分钟终于交费成功顺利下道。在县道上一路慢行（庆幸未堵车）到达游客接待中心，购票后（30元/人）进入景区…。我们还算聪明，在距离景区约3、4公里处找了一户叫做“草原农家乐”的旅社住下，房间大床120/间，标间150/间（价格公道，老板有好几个，都还不错哦，但卫生间和洗漱间都是公用的）。放下行李，带着美好的心情驱车直奔景点…。该景点管理之混乱，车辆乱停、人车都在景区公路上寻找站立位置、就1个公厕（排队上厕比景区买票的人都多，靠！），所谓的大草原？其实就是有点草皮的2个小山坡，没有任何的牛羊吃草，全是游客在拍照和跑来跑去。当地牧民牵着马匹30元/人遛一小圈，扎实无趣。有个小湖泊倒是非常清澈干净，但无法下去实际感受水的清澈和冰凉。滑草场也因头几天下雨草未干没有开放，待了约个把钟头只有打道回府了。
说实话整个景区空气质量、自然环境非常不错，只是其它配套设施还需尽快陆续完善，特别是整个景区管理差的太远，既然要收费就要管理好。以5分制好评来打分，我给目前的乌蒙大草原打2.5分（这2.5分全是打给景区大自然的）。",2018-08-04,IP属地：未知
5分 超棒,X67,门票很便宜吃饭很便宜  只是住的酒店就很一般了 不推荐 还不如在景区外面住 吃饭地方强烈推荐,2018-07-22,IP属地：未知
5分 超棒,gz当地向导伊妹儿,乌蒙大草原最高海拔为2857米，属于高原草场，面积很大，很壮观，景色优美，很美很漂亮，山间云雾缭绕，大风车若隐若现，蓝天白云，牛羊成群，悠然自在；边走边看风景，景致怡人，景区干净凉爽，温度舒适，体感舒服，不亏为中国的凉都，适合遛娃、避暑、休闲的最佳去处！,2022-08-18,IP属地：湖南
5分 超棒,见花花,非常漂亮的大草原，凉爽舒适，气候宜人，不愧为避暑圣地。大草原归属六盘水地区，面积大，地貌多样，日出日落，佛光，山雾景色各异，骑马滑水滑草运动休闲。非常不错的地方,2021-08-06,IP属地：未知
5分 超棒,M69****75,国庆第一站就是乌蒙大草原，小众的景点很惊喜，人不多，比较原生态，随处散放的牛羊马，不要门票，自驾车子可以开进去，走走停停。里面的滑雪场没有开放，其他游乐项目孩子一样玩得很嗨！中午再吃一顿正宗的羊肉汤锅，景区里的消费也不贵，总之夏天有机会还会来。,2020-10-10,IP属地：未知
5分 超棒,M54****527,以为就是一般的景区打卡，去过了不会再去第二次的地方，没想到却是个例外，真的特别适合带孩子去玩。可以吹泡泡，放风筝，旁边还有牛群在吃草；也可以自费骑马，60/90/120元三种价格；当地居民卖的梨子也好吃，一元一个，很甜水分很足；中途还遇到未正式开放的秋千；晚上还可以在景区露营；乌蒙大草原给我最大的惊喜就是能够接近大自然，让孩子在山坡上自由自在的跑来跑去，毕竟好多风景区都有很多规定……,2020-08-23,IP属地：未知
4分 满意,冷风吹,说实在的，乌蒙大草原景区的管理真的不行，路边停车又没有人管理，随意插队，导致堵车频繁，堵了接近两个钟头才上到山顶，凉嗖嗖的，视野开阔，满眼的绿色，有阳光时能看到想象不到的远方，到处可见散养的牛羊，当然，你在草原撒欢的时候随时可能踩到它们的排泄物。一会儿雾飘过来了，下一阵雨，一会儿雾散了阳光普照，开始堵车的不快也随之消散，四川人（还有除北上广深等十多个省）可凭身份证门票五折，15块，值了（本来我们在网上订了票，到了游客中心换票时工作人员就主动提示我们把网上的退了拿身份证可以打折）。推荐自驾，景区相当大，从进山门到最高点观佛台有接近十公里。另：不要在刚进山门那里骑马，不算贵但性价比不高（30元一小圈），而且视野不好，不要在那里吃烤肉串，味道不行，到观佛台那里去骑马（可以10元一圈），而且视野开阔，停车场周围全是小吃，现切羊肉烤串，还有羊肉汤，价格基本跟城里餐馆消费差不多。,2018-08-11,IP属地：未知
5分 超棒,FEIFEIYUN,美丽的乌蒙山大草原，夏天的避暑圣地，稀有的高山草原，有遍地的绿草，夹杂着野花，有童话般的风力发电大风车，有随处可见的牛羊 和骏马。假如你没有来过，试着来一次，你会爱上它。适合自驾游！,2018-07-23,IP属地：未知
5分 超棒,乌蒙大草原旅游包车,乌蒙大草原游玩避暑胜地包车服务联系,2025-05-04,IP属地：贵州
5分 超棒,一个老兵McWilliams,"国家AAAA级旅游景区
乌蒙大草原地处盘州市坪地乡、乌蒙镇和水城区营盘乡交界处，是2000年2月批准的省级风景名胜区，是西南地区海拔最高、面积最大的高原草场之一。最高海拔为2857米，年平均气温为11.1℃，是一个夏日避暑的良好去处。",2022-06-23,IP属地：未知
5分 超棒,hr****788,在游客中心换了门票后，一路开车上山，气温从30一路下降到20，很凉快，路边有小溪，水很冰凉，路上喜欢就把车停靠路边，任你驰骋。骑马，也是不错的体验，但所谓的带你看大峡谷就算了吧。山上有酒店，有露营的地方，是放飞的好地方！,2021-08-15,IP属地：未知
5分 超棒,derric,"乌蒙大草原被评为贵州六盘水排名第一的热门景点，真的是非常不错，有点像美国国家公园的感觉
最可贵的一点是自驾车可以随便开进去，也不收停车费，也不用非要强制购买它的观光车，这样车型起来就很方便，里边有很多木栈道，真的，如果要走起来的话，感觉走一天都走不完，那先不占到都很舒服，你健身步道的方式，唯一美中不足的地方就是它的起点，终点都不能构成环线，要走老远，然后要不就是单线返回，要不就是再找车搭回，或者走公路走回来，这点事情不如国外的好
在山顶上有很多风力发电车，这些风机放在那里，真的是为整个山景增添了很多感官的元素",2020-08-18,IP属地：未知
5分 超棒,曹 操,夏天来这里气温也就在20度左右。乌蒙大草原是西南地区海拔最高，面积最大的高原草场之一。最高海拔为2857米，年平均气温为11.1℃，是一个夏日避暑的良好去处。这里有一望无际的独特高原草场，有万亩高原矮杜鹃林，有充满神奇色彩美丽动人的高山湖泊，有民族文化浓郁的彝族风情，有世界罕见的自然奇观——佛光，并融雄、奇、险、峻、幽于一身的牛棚梁子大山、八担山等。,2020-06-07,IP属地：未知
3分 不错,Anano7,"今日份的乌蒙大草原，之前是叫坡上草原，在坪地和四格两个彝族乡之间，面积蛮大的高山草场，这一季杜鹃花开，景色超美，航拍效果更震撼。但是看美景也是要拼运气，风大雾大，天气不好起雾的话就没意思了。
讲重点，景区管理相当糟糕，小地方的人官僚主义太重，配套太差，明明有卖景区观光车车票，有观光车也让您等上几小时，还质问您怎么不开车去。
开车去的吧一路都在堵车，路很窄，景区工作人员直接把车停路中间，十多分钟下山路，给您堵上1小时。
今天的从售票口排长龙到检票口，因为上面车流太大，堵车，直接不让进。
就这种景区管理坑了这里的景色",2020-03-31,IP属地：未知
5分 超棒,桃子妖妖妖,"乌蒙大草原位于贵州省盘县北部，草原海拔2000米至2857米，是贵州省最高、最大的草场，景区由万亩坡上草原牧场、万亩矮杜鹃林，高原明珠天池，毛沟河溪等景点组成；神奇风光、壮观雾海、高耸风车也在风景群中。

高原顶上的大草场，连绵起伏几十公里，可以自己开车进入，登顶后俯瞰四周乌蒙山脉，气势磅礴。

这里有10万亩万紫千红的高原矮杜鹃林。乌蒙大草原的杜鹃花与其他地方的不同，因为它一年有两个花期，三至五月开一次，十一至十二月又开一次。

登上大草原，漫山遍野的野生杜鹃花，比想像中壮观多了。这里的杜鹃不同于其它高山上那种高大的杜鹃树，而是以高山矮杜鹃为主，花以粉色为主，极少的大红色。

乌蒙大草原的10万亩高山矮杜鹃，是大自然赐予的瑰宝，绚丽、璀璨，令人震撼。",2019-08-27,IP属地：未知
5分 超棒,linda,很好的景色，还有骑马，山上还有羊和牛，还有水（此处叫做海），自己爬上山上，吃上一点当地的新鲜的核桃（15元/斤）、烤洋芋、烤羊肉串，去前先防止高原反应，弄点红花吃一下，会好很多。山上的空气质量非常好，但一定随身携带雨伞，说不定上一秒是大晴天，下一秒有一滴雨，第三秒就瓢泼大雨啦！一点都不夸张，总结贵州地区天气特色。可惜的是因为下大雨，没有去大草坪,2018-10-17,IP属地：未知
4分 满意,乐乐嘻嘻哈哈,其实真的就是被网上的这些照片吸引了去的，可是也许我们去的季节不是吧，虽然也挺美的也挺好玩的，但是的确没有这些照片显示的那样美，以至于，我在手机中也找不到当时的照片了。,2019-07-14,IP属地：未知
5分 超棒,山越郡熊心,适合自驾游的景点，门票30元，开车进去。转一圈开车大约三小时。全程每个路段都有观景平台。可以免费停车。拍照打卡。我们是九月底去的。有点冻。最好带多件衣服。前一天晩上到的。景点附近餐厅吃饭不贵。牛肉60元一斤。份量很足。4个人点了2斤。加若干配菜。打火窝。180元连酒水。6瓶啤酒。性价比高。,2024-12-11,IP属地：广东
5分 超棒,M48****9167,美丽广阔，值得一去。景区附近的牛肉火锅很好吃，草原上的风景真的很美。也希望大家不要把车开到草场里，随手把垃圾袋都带走。一路上的工作人员清理的真的很辛苦，优美的环境需要我们一起维护。,2024-02-05,IP属地：甘肃
5分 超棒,M43****9783,六盘水是凉都，暑假到六盘水避暑，来到了盘州乌蒙大草原。由于自己对景区路线不熟悉，租了住的漫时光花园客栈的老板娘开车带我们去乌蒙大草原转，她带我们在上面转了一大圈，风景很美。里面空气很清新，真是天然氧吧。特别适合在里面好好放松心情。,2023-07-28,IP属地：贵州
5分 超棒,好景致,乌蒙大草原是休闲、避暑的好地方，这里是彝族居住区，景区有几十个景点，近几年这里已经成了网红旅游地，很多人都喜欢到这万亩坡上草原旅游，领略彝族风情和大西南的草原风光，延绵起伏的草地、平缓低矮的小丘，牛、羊、马时常出现，碧野万顷，一望无垠，极为壮阔。,2022-08-12,IP属地：山西
3分 不错,waughan,沿路景色都不错，贵州的山都是郁郁葱葱，看着都很漂亮，当天有雨，沿途远望群山，真有江山如画的感慨，看看景色不错，只是兜售骑马的当地人比较煞风景，想静静地待一会儿都不行，一直在揽生意,2019-06-02,IP属地：未知
5分 超棒,取什么嘛,不错!我是7月底去滴，太凉快了。我大重庆7月份40度左右，到了大草原中午12点车内显示才19度太凉爽了。天空蓝蓝的，感觉离天空白云好近，脚下一片绿油油滴草地。风景如画呀！,2018-09-13,IP属地：未知
5分 超棒,熠昕猫猫,乌蒙大草原的魅力，在于它**「野性与温柔并存」**。你可以在晨曦中追逐云海，在午后慵懒地躺在草甸上发呆，也可以在星空下与陌生人分享故事。这里没有打卡式的疲惫，只有纯粹的放松与治愈。,2025-04-21,IP属地：贵州
5分 超棒,胖魚头,乌蒙大草原位于贵州省六盘水市盘县境内，开车自驾在山区公路上，虽然路况比较险峻，但双向两车道公路修得非常平整，自我感觉很安全。乌蒙大草原就在山区之中，连绵不断的群山和草原交相辉映，牛、羊、马等牲畜漫游在草原上，构成了一幅和谐的自然景象。草原上还修造了不少木质的栈道，以方便游客登高眺望美丽的自然风景。,2023-09-06,IP属地：贵州
5分 超棒,好景致,毛主席说“五岭逶迤腾细浪，乌蒙磅礴走泥丸”，这里的乌蒙是乌蒙山和乌蒙大草原，位于贵州盘州市。乌蒙大草原是我国西南最大和海拔最高的草原，现在是广大旅游爱好者趋之若鹜的地方，这里有神奇的佛光，有彝族风情，每年农历六月二十四有火把节，山歌阵阵热闹非凡。,2022-08-11,IP属地：山西
5分 超棒,M49****6878,乌蒙大草原天高云淡，视野开阔，总有登顶而小天下之感！特别是春天，4万多亩高山矮杜鹃竞相开放，甚是醉人；还有那碧玉般的天池，如幻如梦的佛光，蒙古包的天然美食，滑雪场及波璃滑道的诱惑，让天下房车游客增添了＂天上居＂的超脱感！,2021-10-01,IP属地：未知
4分 满意,销售达人,门票价不高，适合自驾；景色不错；切记不要在第一个停车点骑马，很坑，30/人，走不了几步让你加30，说是带你多转一段路，其实就多走几十米，继续忽悠你加钱转到大帐篷处，抢客跟抢人差不多，太糟心了。,2018-07-24,IP属地：未知
5分 超棒,yunyun@,这里气候凉爽 ，是天然的氧吧，很适合夏天去，很舒服。,2025-04-18,IP属地：广东
