评分,用户,评论详情,日期,IP位置
5分 超棒,匿名用户,奔着“乌蒙山连着山外山”，自驾游览乌蒙大草原，提前做了攻略，在乌蒙大草原公众号预约了车辆，先买了门票，所以从景区一号门，畅通无阻进入，沿着小海子，天池，长海子，再到十方云舍，再到观佛台，百草坪，最后从二号门出来，青青大草原，到处可见成群的牛羊、马儿，途中遇到阵雨，雨过天又晴，还有大大的风车，朵朵云海，让人目不暇接，人不少，路上偶尔错车难，这个时间很凉爽，日照强烈，紫外线很足，所以一定要做好防护，很愉快的旅途,2024-08-31,IP属地：贵州
4分 满意,lilywu001,在山顶上能有这么一个宽阔的草原很不错！人也不太多在网上买票后还需要去游客中心换票。只适合自驾游，车子可以直接开上山顶！里面有一些卖小吃的，目测都不咋样。景区周围也没有什么吃的，建议避开饭点前往。整个游玩时间大约2-3小时足够了！,2022-07-18,IP属地：未知
5分 超棒,Adeline,"第一次来乌蒙大草原，带着两个孩子。这里，随便一个山头就能放风筝 随手一拍都是手机屏保电脑桌面 还能偶遇归家的羊群 美丽的落日 粉红的晚霞 清新的风 彝族的美女。。。这里还有贵州海拔最高的湖泊，虽不及内蒙草原的辽阔却独有2000多米海拔的凉爽气候。。。这里是，乌蒙大草原。
记得带厚外套啊，风很大，早晚温度很低。",2021-10-03,IP属地：未知
5分 超棒,tomzhao,六盘水火车站的停车场有到乌蒙大草原的大巴车，车程近2个小时，景区大门口凭携程订票短信换票入园，乌蒙大草原景区很大，需要自驾或者包车游览，一下大巴车就会有司机过来询问要不要包车，200元可以负责带你把主要景点游览一遍。景区草原一望无际，牛羊成群，非常凉爽，非常值得游玩。回程还在下车的地方等车就行，末班车大概五点半左右。,2021-08-19,IP属地：未知
5分 超棒,Olina Yu,登上乌蒙大草原，“白云生衣底，苍穹跨杖头”云海全在你的脚下，而不是在遥望中的彼岸。看星空、观日出、望云海、邂逅佛光……岁月温柔终无言，繁华冉冉落去。执着慢慢释怀，无论我们是站在世俗之外阅尽繁华，还是在世俗之中百味尝尽，终究是要放手执念，从容面对。这浮生，终如梦一回。,2020-10-05,IP属地：未知
5分 超棒,M25****4454,我们是从六盘水自驾去的，从乌蒙大草原游客服务中心进入景区，路况很好，游玩后从后山大门出景区回六盘水，结果后悔莫及啊，走了两个多小时的盘山公路才能上高速，感觉就是一条走不完的盘山公路，途径S212盘水路段，在这里给自驾来游玩的朋友提个醒，从游客服务中心进入景区。游玩后，一定要原路返回，切记切记不要从房车营地旁边的路出景区大门,2020-08-23,IP属地：未知
5分 超棒,M22****8512,"我们此行是将乌蒙大草原-马岭河大峡谷-黄果树-龙宫-青岩-荔波小七孔-千户苗寨-镇远-梵净山-遵义绕了圈！对于贵州旅游还是有点发言权了，嘻嘻！
乌蒙大草原推荐一定要去一次！这是在山顶上的草原，自驾车可以开进去景区直接到山顶，沿途有很多观光栈道，如果你想把栈道全走一遍，那得有马拉松的体力！到草原骑马看峡谷，到山顶看云端，只想感叹中国真是大好河山，嘻嘻！景区设计很人性，路是盘山公路，但很好走！
最后弱弱问句：乌蒙为啥不是5A？ 太可惜了！
一定要去！！！",2020-07-27,IP属地：未知
3分 不错,豆丁爸看世界,这是个云贵高原上的草原，跟内蒙古大草原不一样，看起来就是草甸，而且长的草也跟内蒙古的不同，我们看了天池，就像个大一点的水塘，不过配上蓝天白云以及草原，看起来还可以吧。观佛台就是很难看到佛光了。百草坪据说是可以骑马骑骆驼的地方，结果除了一群绵羊，就是几匹川马，只能牵着走，没什么太多意思，而且海拔2800多米，有人还会有点高原反应，不是很推荐。,2018-09-02,IP属地：未知
5分 超棒,M60****564,太美了，超呼我的想像，高山湖泊，牛羊成群，美丽的高山公路，草原里的木头步道，人和自然和谐相处，一派岁月静好，有趣好玩，景色不错，体验很好，值得推荐，天气很凉爽，下次还会去玩的，,2020-07-10,IP属地：未知
5分 超棒,M50****4691,景点很棒、很大，现在这个季节上面绿油油的一片、山美水美，还有网红打卡酒店，十方云舍，环境和周边景色都一级棒，可以喝咖啡、吃特色牛肉、特别的巴适，挺适合夏季出游的，推荐玩一天,2022-07-29,IP属地：贵州
4分 满意,紫聆珍珠妈,乌蒙大草原建议开车进去，里面很大，很多人在里面搭帐篷夜宿！风景很美，空气很好，消费的项目就是骑马，30元一圈！吃的食物不多，建议自己多带点干粮！里面也有酒店，可以住宿！,2018-08-15,IP属地：未知
5分 超棒,M25****774,司机师傅热情专业，预约好了入场带我们在景区逛了一天，还带这我们看了所剩不多的杜鹃，停车的几个地方都没有景区摆渡车的停靠站，包车是正确的选择。乌蒙草原和内蒙的草原不一样，在乌蒙草原上四周环顾是绵延的群山，天高云淡，壮丽寥阔。,2024-05-05,IP属地：贵州
4分 满意,我行我述的Winny,乌蒙大草原景区太大了，必需自驾！虽然没有什么特别的景致，但是现在暑假门票才15元，60岁以上人士还免费！开车在里面兜兜风挺不错的，高山牧场气势磅礴，现在过了杜鹃花的花期，就是一片苍翠，运气好呢还可以看到云海佛光。骑骑马逛逛牧场，尝尝本地特产羊肉汤牛肉干，也是不一样的避暑体验。👍👍👍🌹🌹🌹,2023-07-03,IP属地：贵州
5分 超棒,游游游游游啊游,门票免费，自愿选择是否买保险。可以开自己的车进去。路好但弯道较多，上坡路较多。出游当天运气超级好遇见短暂的晴天。后面雾蒙蒙的氛围也是很赞的。总之超棒的一次经历！,2020-10-07,IP属地：未知
5分 超棒,M25****3839,景区门票免费，在票务中心领取即可。可以开车进去，走到哪里遇到好景色，看见有停车的地方就可以停下来去拍照，山上有很多条木栈道，喜欢健步行的朋友可以去走走。我们去的时候是淡季，人不太多，雾气蒙蒙，远处景色时隐时现，别有一番惊喜！夏天有滑草、滑梯、烧烤、骑马等，冬天有滑雪等。值得推荐，体验很好，景色不错，,2020-09-27,IP属地：未知
5分 超棒,盘尼西林111,要吹爆乌蒙草原！景区工作人员服务态度超级棒！我们这次来的时候人少 有幸得到几个工作人员陪同一起玩，还帮忙拍照，真的太太奶思了。春季是整个大草原的杜鹃花，夏季是绿油油，秋季忘了，冬季就是图下 每个季节来性价比都超级高，真的 自驾车来也很棒！,2019-01-11,IP属地：未知
4分 满意,M24****590,景色还好，去的前一天下雨了，第二天有雾影响观景。如果遇到雾天不要在刚开始的地方逗留，景区最后有个百草坪景点，那里很漂亮，地势开阔，风大，一般没雾。建议提前来，8点售票厅开门，9点以后车真的超级多，一直都在堵车。我们是头一天下午去买了票，第二天7点半进景区，在景区拍照的时候基本周围都没啥人和车，拍出来照片很开阔。快11点开始往回走，进来的路堵好几公里，景点全是车和人。但是出去的路车很少，完美避开了高峰期。玩的很开心,2018-08-09,IP属地：未知
5分 超棒,猪嘴鱼008,值得一去！很美，我们是十一月底去的，如果夏季应该更美。门票30元，最好自驾游，车子可以开进去，游玩很方便。景区门口附近的回头客羊肉馆，很不错，价格合适味道好！,2018-12-01,IP属地：未知
5分 超棒,眼中有美,高山牧场，风车与蓝天呼应，很有特色；景区很大，可随意选择，有些路段因路旁随意停车有些堵。夏季非常凉爽，但要注意防晒；临时用高德地图在网上购票很方便且有优惠。,2022-08-09,IP属地：云南
5分 超棒,_WeCh****227762,乌蒙大草原，风光壮美，交通路况特好，景区景点多，一路自驾，停车方便，居然不收停车费。雨停雾随，风起云开。景区食宿物美价廉，民风淳朴。,2021-05-04,IP属地：未知
5分 超棒,听闻远方的你,在山上的草原，是我今生第一次的遇见。车子自驾环山而上，晴空万里，虽然是9月，但是非常凉爽，最高气温只有15度左右，六盘水的乌蒙大草原，不愧是奇迹，南方的草原正如人们点评一样，是我向往的地方。,2023-01-07,IP属地：上海
5分 超棒,麦克斯顿2,你知道吗？有个地方叫乌蒙大草原超级美的说!我好想亲自去看看啊~💨(๑˃̵ᴗ˂̵)و✧*｡………………………………………,2024-08-19,IP属地：广东
5分 超棒,_WeCh****946799,来贵州玩，顺路来乌蒙大草原看看，要想不堵车，最好八点以前就到景区1号门，排不了多久就进去了。景色嘛，因为我四川人，去过几次川西，也去过大西北，所以相对来说没有多惊艳的感觉，不同的是这边的草原全是黄牛，还有人喂食，甚至能摸到，对于小朋友来说特别新鲜，有的牛甚至直接守在别人的帐篷旁边等吃的。川西全是黑色牦牛，不敢惹的那种，哈哈😃😃。进来之后我们是找了个露营基地搭天幕，躺平式的耍了大半天，不管景色怎么样，小朋友特别喜欢这种方式，因为不用赶路，不用人挤人景点排队打卡排队之类，总体是比较轻松的玩耍。后面又去了马岭河，万峰林，小朋友还一直念念不忘想念大草原。,2024-08-18,IP属地：四川
5分 超棒,匿名用户,"真心推荐，就是要错峰出行，避开旅游高峰，否则堵车严重。大家注意把垃圾清理干净带走。
真心推荐，就是要错峰出行，避开旅游高峰，否则堵车严重。大家注意把垃圾清理干净带走。
真心推荐，就是要错峰出行，避开旅游高峰，否则堵车严重。大家注意把垃圾清理干净带走。",2023-08-23,IP属地：广东
5分 超棒,无疆行,这个已经种草了很久，今天终于有时间来，完全没有踩雷呀，整个过程非常过瘾逛街逛累了，非常适合来这放松休闲一下，提前买好券就更划算了放心来就对了，体验感一级棒，总之非常推荐各位来打卡很适合周末和朋友们一起来呀，度过一个快乐周末！也推荐大家来呀嘻嘻体验很好，以后又多了一个周末游玩的好地方✌️✌️位置很好找，虽然是周末来的，但🅿️停车位还挺多的，非常方便,2022-09-20,IP属地：湖北
5分 超棒,M11****211,一个月前去了川西，今天来到了乌蒙大草原，和川西的草原相比同样的风景秀丽，但这边因为海拔相对要低一些的原因更适合大多数人游玩。同时不得不吐槽的是交通组织实在太差，路边乱停车严重，没有工作人员梳理交通，全靠时间去缓堵，另外路途中的各种烤羊肉也不知道是真是假，看到老板不断的在撒各种调料，一吃简直汉到家了。,2022-08-13,IP属地：贵州
5分 超棒,M29****5799,"这一趟非常开心，天气简直不要太好，夏天的避暑圣地。我们一家人自驾游，上午在网上定的门票，下午在游客中心换了票就直接开进景区入住了，很顺利。一路都是景，蓝天白云草地…空气好的呼吸都是甜的，满山的牛羊自由的吃着草。酒店服务员推荐地点看了日落晚霞和日出，简直太美了，特别是日出。
太阳伴着牛吃草的声音缓缓升起，闻着淡淡的青草味儿…让在城市里待久了的人身心放松，爽极了！就是早晚有点冷，需要多带件外套。有趣好玩，体验很好，值得推荐，景色不错，",2020-07-31,IP属地：未知
5分 超棒,猪嘴鱼008,太漂亮了，非常美，最适合自驾游，我们开车进去，看见美景就下来拍照，那里的牛羊也非常的漂亮可爱，虽然是初冬，但天公作美，一点都不冷，大太阳照起还有点热。蓝色很近，万里无云，高原上的大草原美不胜收。来吧，朋友们，不会让你失望的！,2019-10-09,IP属地：未知
5分 超棒,ZZY0227,过年去的时候，山上还有积雪，小孩玩的很开心，毕竟我们这里不容易看到雪景的，景区下面就有民宿，虽然设施一般，但是老板热情，当地牛肉很不错👍,2022-05-26,IP属地：未知
5分 超棒,俊采星驰,云贵高原之间的高原天然草场，进入景区，牛羊成群，天池美丽传说，骑马观云海，烤全羊，篝火晚会！让快乐在这里飞扬！,2016-06-26,IP属地：未知
5分 超棒,gz当地向导伊妹儿,乌蒙大草原景色太美太迷人，视野开阔，温度非常的舒服，可以玩上一整天，拍照、撒欢儿的好地方，也是值得推荐给大家的避暑胜地，美极了。,2021-07-28,IP属地：未知
5分 超棒,玛雅行走的杂货铺,"乌蒙大草原｜高山草场 目之所及 一望无际

位于贵州盘州的乌蒙大草原有多大呢？仅仅高山草场就超过十万亩，还有五万亩矮杜鹃林。沿着盘山公路开行七八公里的样子，一片片恢宏的连绵起伏的高山草甸一直延伸到目光最极处，然而当你驾车抵达刚才的目光最极处，前方又是无边无沿的草场。

如果忽略掉脚下的云团，这里和新疆内蒙的丘陵草场很相似，但乌蒙大草原却是海拔超过2500米的云端草原，远处山谷里快速上升的雾气在山腰中慢慢凝聚成云，再继续爬升，然后被山风送上高空，所以我们头顶的云聚云散似乎像是倍速镜头，阳光才刚刚晒到半边脸，新的云团就迅速遮住太阳，气温跳动幅度之大以前从未体会过。

半山里高山湖泊长海子安安静静的守在那里，波澜不惊，一位勇士腰间系着气囊在冰冷的海子里孤独的游着……

乌蒙大草原错落的草场里到处是悠闲吃草的马匹牛羊，也不知道来自哪里，主人是谁——目测周围几公里没有任何村庄。
我们开车越过一个又一个丘陵，掠过一片又一片草场，眼前的公里依然稳稳的在前方延伸到天尽头……好吧，认输了，天色将晚要返程找住处了。

半山的长海子旁边是有一处蒙古包酒店可住的，条件略简陋些，但难得的是在大草原内部，走出帐篷",2022-08-03,IP属地：云南
4分 满意,小企鹅粑粑,"需要在游客中心换票。
里面太大了。只适合自驾，估计得有20来公里吧。
4月10日去的，大雾一直都有，每隔一点地方天气都不一样。风景还是不错的。不过杜鹃花之前被雨打了。不太有精神，不怎么美了，估计3月底好些吧。

里面草原美食城有羊肉汤，羊肉120元一斤。味道还是不错的。里面每隔几公里都有吃的，卫生间，也还方便。
整体推荐的。",2021-04-11,IP属地：未知
5分 超棒,189****3446,去的时候，乌蒙的天气不错，没有雨，阳光灿烂，蓝天白云！有牛羊、马屁，有清澈的湖水，晚上还有篝火晚会！不过早晚温差大，要注意带衣服保暖！还有个帐篷营地，值得一拍！,2021-02-23,IP属地：未知
5分 超棒,未末旅记、,"这是一篇一个多月后的文章，并没有打算写发布的，我去的时候已经是11月份中旬的时候了，那时候草原上已经没有多多的草毕竟是冬天了，但是拍出来也是足够让人家知道是草原的地方了，
1、关于交通方面：我强烈推荐
	
一定要自驾，一定要自驾来！不要听别的红书推荐说什么建议自驾，你真不自驾来会后悔的走死你而且太不方便了 打车也是打不到的，我就在周边100公里的地方，发布了二天顺风车没有人接单，打的大概480多，我选择包车去的，和朋友3个人分下来也就166一个人，500一辆司机陪一天司机人挺好的，朋友介绍的名片去问的开始600后来一直谈杀价到500成交，下了高速后就是围着山上去绕从底绕到最上面盘山公路，绕啊绕啊绕绕绕，晕车的人就彻底完蛋了！做好和我一样晕吐的准备吧，太晃绕折腾人了，一定备好凉药去闻会很难受的、
2、现在景区不要门票免费的，但是呢？比较多此一举的就是网上预约了还得到底下的服务站去拿身份证取票不然不给进，所以这点还是很多此一举的，希望官方改进吧，服务站前面就有买风筝帽子等的啊婆也不贵 但是还是要记得啥价但也别太多毕竟人家卖的真也挺优惠了，山上风超级大放风筝的好去处可以在这里买了上去放、",2020-12-09,IP属地：未知
4分 满意,189****3446,大草原风景是不错的，山上呆了两天，天气还可以，人品大爆发😄早晚温差大，晚上特别冷，多带点衣服上去。体验集装箱酒店，心里落差很大，房间面积可以，可是床上用品有发霉的地方，卫生间大，但是积水容易滑倒！悠悠然木屋酒店附近的小饭馆又贵又不好吃，份量还少。篝火晚会鸡肋，骑马要讲价！幸好牛羊马不少，孩子很喜欢，天气好的时候拍照，风景也是美的。,2020-11-08,IP属地：未知
5分 超棒,derric,"乌蒙大草原号称中国凉都有中国最凉快的地方的称号，整个草原有点像美国的国家公园，最好的一点是自驾车可以直接开进去，不用一定买公共车票，非常自由，一边不管他，站到各种干的地方，还可以看到佛光是一个很值得玩一下的
携程上的景点排名也把他排在整个六盘水第一名，在景点里边和景区外面都有很多住宿和吃饭的地方，生活不愁",2020-08-31,IP属地：未知
5分 超棒,320****479,这辈子值得再来一次的地方！高原草甸，牛羊成群，山峦起伏，天低云接，非常像油画。适合放空自己，照片也拍不出它的雄壮和美丽。可以骑马，可以登山，可以远眺，也可以坐在山顶看着牛羊静静发呆😳。山中天气变幻莫测，云雾缭绕，仙气十足。遇上雨天，要带厚衣服。烤鸡腿很好吃。,2020-08-19,IP属地：未知
5分 超棒,sky-china,"来之前做了攻略，知道是一个山地草原，但是看到实景还是非常美，遍地绿色，开车在盘山公路上转悠很容易看到牛羊，他们有点怕人，想拍照的话不能走太近哦，到处都是美景，都不需要修图的，如果带了帐篷还可以野营，里面还有个漂流和滑道，有兴趣的也可以体验。
我们去的时候是七月份，很热的天气因为这里海拔接近3000，短袖觉得冷，我还只好找了个浴巾披着，建议至少准备长袖，如果其他季节的话要相应的加衣服 吃饭可以在本地人的饭店解决，烤羊肉，羊肉汤都是很好的，选择，景区支持自驾，进来之后自己开车，想在哪里停下都可以，建议不要堵住路哦。",2020-08-14,IP属地：未知
4分 满意,我也爱边牧,乌蒙大草原位于贵州省盘县北部，海拔2000多米，这里有万亩矮杜鹃林，有高耸的风车，自驾登顶后可俯瞰四周乌蒙山脉，，这里是西南地区海拔最高，面积最大的草原，是个风吹草低见牛羊的地方，成百上千的午羊在草原上自油自在的吃草漫步，过得悠闲自在。,2020-02-25,IP属地：未知
5分 超棒,大青蛙在闹,从重庆过去，最热的时候过去的，温度适合，价格便宜，高速减半，门票减半，贵州风味的小吃，就是住宿太贵了，实在住不起，不然可以一早起来看到云海，天气好的时候去很适合拍照，都不用P图，全家人一起或者亲子出游的好去处，，,2019-10-22,IP属地：未知
4分 满意,D65****62,"去时遇到道路塌方，改道而行。开到景区已经是中午。在景区入口之前吃了午餐，再进到景区。当地的朋友说春天杜鹃花开时更好，夏天来没有遮挡，怕紫外线会太厉害。开车可以找不碍事的地方停下来，挨着大风车放风筝或者拿个餐垫吃点零食。看上去不是“风吹草低”，却也十分开阔，有光影略动，草甸明暗交错，心旷神怡。朋友说有帐篷酒店需要提前一月预定，每天也有篝火晚会，如果能赶上看日出更美。山路开起来很棒，弯道很多，起伏也很大，敞篷打开孩子露出头开心得一直哈哈大笑。景区公共厕所很方便，也有餐饮酒店，因为晚上要赶回去没有往深处开。有机会再去。
【性价比】
【趣味】
【景色】",2019-08-14,IP属地：未知
5分 超棒,88top,乌蒙大草原，在当地人口中又叫坡上草原。是避暑、休闲的最佳去处。因为位于两个彝族乡镇之内，所以这里保留着原始、淳朴的少数民族风情，在每年的彝族火把节（农历6月24），当地的少数民族同胞们都会盛装来到草原上，对唱山歌，跳起彝族的达体舞，来庆祝他们的节日。,2019-08-13,IP属地：未知
5分 超棒,寻觅理想,"2018年10月3日到达，网上订票25元，景区观光车不多，最好自驾上山，可以看到不一般的美景。由于天气不好，雾大，没看到很好的景色，听当地人说最多是3-9月份游玩。明年夏季再来。

",2018-10-05,IP属地：未知
5分 超棒,展路迎风,辽阔高远的高山草场，自由自在的牛马羊三五成群的点缀在蓝天白云和绿***水之间，若不是热情又宣嚣的游客，这种宁静、悠远的田园风光真是洗却尘挠、平心静气的好地方。,2022-08-02,IP属地：贵州
5分 超棒,山越郡熊心,景色宜人，我地系自驾游的。九月份去的。要穿多件衣服。温差大。十六七度左右。有点凉意。,2024-11-24,IP属地：广东
5分 超棒,淼淼,天苍苍，野茫茫，风吹草低见牛羊……一幅幅意境很美的图画，天气很好，很是凉爽，没有阳光的暴晒，入住在附近的帐篷营地，很有感觉。,2018-06-14,IP属地：未知
5分 超棒,匿名用户,"暑假期间成人门票打5折，小孩免票，性价比太高了。
乌蒙大草原绝对可以冲，我们在山上住了一晚，看了很棒的夕阳和晚霞，一家人骑马也开心（可以讲价的，10块20块都可）。",2024-01-08,IP属地：泰国
5分 超棒,Gabriel Cheung,3月的乌蒙大草原，漫山遍野的高山杜鹃，有几条健康步道可以穿行，景色非常壮丽。可惜花开时间较为短暂，3月下旬去花季已近尾声。,2021-03-29,IP属地：未知
5分 超棒,维130405,去过好几次了，一路美丽风景，好吃的，好玩的东西太多了，可以骑马啊，荡秋千啊，滑雪大冒险啊，等等……自然的景象，美丽惊奇，特别是杜鹃花开的季节。,2019-07-17,IP属地：未知
5分 超棒,化在掌心的雪,"非常值得来的高山草甸，景观绝美，但一定要晴朗的天气来，最次也是阴天，千万千万不要雨天，不要想着雨蒙蒙，车非常不好开（危险+堵车+可能的陷车）
凭门票直接从1号门进（不一定要车辆预约成功），门口放行很快，不建议2号门进，又远+没景观，而且会被其他按规则行动的游人骂死，还有交警五步一岗等着",2024-08-15,IP属地：贵州
5分 超棒,marie1234,来六盘水非常值得去的一个景区，门票30元，60岁以上免门票，自驾车辆可以进入，也可以乘坐景区观光车进入，个人感觉最美的地方是百草园，非常出片,2024-08-07,IP属地：四川
5分 超棒,半盏晚风,携程有活动，优惠了10元，电子门票也方便，不用停车买票，直接开到验票大门那，不用下车，有工作人员来扫二维码就可以了。国庆大假期间实行单向通行，即一号门进二号门出。平时两个门都可以进出。回程导航北盘江大桥观景台，去打了个卡，还是有点小远,2023-10-10,IP属地：四川
4分 满意,我行我述的Winny,"乌蒙山大草原有万亩坡上草原，景区没有摆渡车，只能自驾。在这里可以探寻贵州独特的高山草原，领略朴实的民族风情。夏天虽然就是一片翠绿，更显高山草原的壮观！运气好的话可以看到云海佛光。天气好的时候骑马在草原上溜达，然后品尝一下草原人家的清汤羊肉和牛肉干过过嘴瘾。
这里还有万亩杜鹃林，春天赏花应该是另一番光景。",2023-09-06,IP属地：广东
5分 超棒,M24****6663,乌蒙大草原很漂亮，全程自驾，旺季只能单循环，1号门进2号门出，千万不要逆向行驶，会造堵，交警也会拦。路上有很多骑马的，我们在观佛台骑的，80块钱一圈，可以去看大峡谷，一路有湖有草原，天很蓝，云很美，还可以玩空中漂流，孩子很喜欢,2023-08-19,IP属地：四川
