评分,用户,评论详情,日期,IP位置
4分 满意,礼文郡刘瑾,值得去看看，孩子会喜欢这里的，看看海洋里的各种生物，还有节目表演。,2019-02-11,IP属地：未知
3分 不错,M16****499,玩过的性价比最低的海洋公园，两个馆很小，一会就走完了，卖东西的地方缺很多。表演也很次，居然还有街舞表演，海狮表演的场地很是简陋。带孩子随便看看，两三年去一次差不多了。,2018-08-05,IP属地：未知
4分 满意,M38****2450,国庆期间去的，停车场离大门入口需要步行5分钟，免费。当天中雨，以为人少，结果依旧人山人海，所以体验不会很好。里面的水下表演很精彩，水母很多很美。,2020-10-29,IP属地：未知
5分 超棒,维斯普孟浩然,动物种类丰富、节目表演精彩、设备先进齐全、是个非常不错的亲子、家庭游的地方，值得推荐,2019-08-23,IP属地：未知
4分 满意,东东家园,展馆不大，动物种类有海豚、海龟、鲨鱼、魟鱼、水母等等，不算太多，还是很适合小孩子玩，就是票价有点小贵。,2019-02-15,IP属地：未知
5分 超棒,M28****8949,非常棒的海洋公园，精彩的表演，种类繁多的生物，还有供小朋友玩耍的沙池。。还会再来,2019-02-16,IP属地：未知
5分 超棒,286****221,适合带小孩子去玩，我们去的时候下雨，最好晴天去，还有室外的适合小孩子玩的滑梯，沙,2019-02-10,IP属地：未知
5分 超棒,_WeCh****561152,小孩觉得好耍，总体不错，就是表演很随便,2018-06-08,IP属地：未知
4分 满意,暮槐, 景区内展览馆不是很大，建议大家来的时候先在表演厅把所有的表演全部看完，然后再去游了。表演很精彩。,2019-08-19,IP属地：未知
4分 满意,M22****3363,这个海洋馆很不错的，也属于当地比较热门旅游景点之一，游客很多，而且交通方便，并且海洋动物很多，门类很全，品种也丰富，带孩子来孩子很开心,2019-12-10,IP属地：未知
5分 超棒,自娱自乐最开心,很不错哦，想要去的小伙伴不要犹豫了哟，表演节目也是很精彩的呢，只是各位小伙伴不要选择节日去哦,2019-10-04,IP属地：未知
4分 满意,M22****3363,海洋公园永远是孩子最爱，里面海洋动物很多，许多都是平时难得一见的，交通便利，工作人员也热情，次序不错，孩子可以看半天，拍照也美很，,2019-12-04,IP属地：未知
5分 超棒,M41****332,内容很丰富，大人小孩都要得很开心，夜场票人也更少，但是时间略紧张。美人鱼🧜‍♀️好评,2022-08-28,IP属地：重庆
5分 超棒,e15****55,这是第二次来这个海洋馆了，孩子非常喜欢！里面的海洋动物还是挺多的，是亲子游的好去处！,2024-07-22,IP属地：四川
4分 满意,M22****3363,这个海洋公园很不错，也是当地旅游必打卡景点之一，游客很多，带孩子来这里，他很开心，里面海洋动物很多，而且许多都是第一次看到。,2019-12-14,IP属地：未知
5分 超棒,左金龙,很适合带着宝宝一起出游，虽然只有两个场馆，但是逛下来也得个把小时,2019-02-26,IP属地：未知
3分 不错,像路人一样路过,很小，不是很大只有两个馆，景色还行，数量不多，性价比不是很高，感觉门票贵了一点吧，有待改进，性价比低，景色一般，可玩性低，,2020-11-30,IP属地：未知
5分 超棒,_WeCh****251159,一定要提前2小时购买才可以进去，不然二维码扫描不出的，不用取票，直接用购买的二维码扫描，我们停停走走，约90分钟就逛完了，说实话真的失望，设施不够完善，地方也不大,2019-05-01,IP属地：未知
5分 超棒,ahao1979,科普性很强，娱乐项目也比较多，目前只有两个场馆和一个室外表演场，期待二期项目的上马和运营👋👋👋👋👋👋👋👋,2021-08-04,IP属地：未知
4分 满意,韦格伯根呼特基蒂,最美的要属于水母 真的太美了 很神奇 领悟到一个大自然的美  还没有去的小伙伴可以去参观一下  可以打卡打卡 ,2021-03-25,IP属地：未知
4分 满意,Luo_jun,乐园不大，只有2个馆，票价显得高了点。小朋友还是玩得高兴。海狮表演小朋友很喜欢。,2020-10-07,IP属地：未知
