评分,用户,评论详情,日期,IP位置
4分 满意,社会颜色,毕节市百里杜鹃景区位于贵州省毕节市中部，总面积125.8平方公里，享有“地球彩带、杜鹃王国、养身福地、清凉世界”之美誉。 毕节市百里杜鹃景区主要旅游景点有杜鹃林带、百里杜鹃大草原、米底河、杜鹃花王、千年一吻、黄家坝阻击战遗址等，杜鹃林带呈环状分布，延绵50余公里，宽约1～3公里，生长着杜鹃花5个亚属中的全部品种，最难得的是一树不同花，可在一棵树上开出不同颜色的花朵，达7种之多。,2020-12-13,IP属地：未知
5分 超棒,卡默斯朱允炆,花都开了，很漂亮，去年就想去，，，，          两个景区分开了，门票可以通用，观光车35元，建议坐,2019-04-02,IP属地：未知
5分 超棒,我还是me,"盛花期肯定美的
一个金坡 一个普底，名字就在那了，金坡必去
不确定普底是成片开花，就别去

不确定普底是成片开花，就别去

不确定普底是成片开花，就别去

二小时一处，除非疯狂拍照",2025-04-07,IP属地：贵州
5分 超棒,new2000th,把花儿留在枝头把美丽留在心头，百里杜鹃果然名不虚传，20多个少数民族居住和5a景区，，依托观光群体创建度假民族特色小镇，，打造宜居和旅居百里杜鹃度假集散地正当时！,2018-08-15,IP属地：未知
4分 满意,天空下一片云,毕节百里杜鹃，上午在普底花山花海徜徉，美极，词穷，只会“哇一一”，下午在金坡花树下穿梭，映入眼帘，皆是花，我已晕花。百里杜鹃景区真大呀！真不负其125.8平方公里之名，走了一天，也仅仅观其皮毛。上春山，寻春光。春光漫漫春花开，春花开，开在人间处处好。你来吗？,2024-03-29,IP属地：贵州
4分 满意,134****5938,来得稍晚，杜鹃花有些谢了。景区很大，我们选择在普底景区赏花。停车场足够大，有工作人员指挥。在网上购买了35元摆渡车票，10元安全包。我们导航到百里杜鹃西门，到游客中心刷身份证就顺利进到景区。景区管理不错，停车、参观都非常有序。容纳量也大，人行和车道分开，避免发生安全事故。盛花期，工作人员非常辛苦，但是大家对游客还是非常耐心、友善。,2023-04-15,IP属地：贵州
4分 满意,M52****1714,"2023.4.3日百里杜鹃普底景区，满山遍野的杜鹃树杜鹃花，和我在别的地方见到完全两样，看杜鹃就来这里。
景区人员说，由于今年气温比较低，花是逐渐开放的。如果杜鹃花开的时候气温高的话，杜鹃花的大部分花蕾一下子爆发开放才会更壮观。本地人说现一边开，一边花开始落了，今年差不多就这样了。
金坡景区的花，有人说今年反常比普底开的晚！景区工作人员说因为景区的被冰雹打过，根本就这样了。",2023-04-08,IP属地：上海
4分 满意,贵人,百里杜鹃景区主要有两部分，一个是金坡景区，一个是普底景区，金坡景区一般体力的人要坐电瓶车，走路很远的，普底景区可以不坐电瓶车，想节省时间和体力的就坐到顶一路走下来更好，景交车淡季20，旺季35元有点小贵，两个景区门票通用，景交车票不通用,2023-03-26,IP属地：陕西
4分 满意,首席监理,百里杜鹃风景区位于贵州省西北部、毕节市中部，距贵州贵阳龙洞堡机场122公里、贵州遵义新舟机场153公里、贵州毕节飞雄机场40公里、贵州黔西高铁站32公里、贵州大方高铁站23公里。景区冬无严寒、夏无酷暑，年平均气温14.8℃，夏季平均气温19℃，因绵延125.8平方公里的高山原生态杜鹃林带而得名，是世界上面积最大、品种最多、景观最震撼的天然杜鹃林带，也是国家5A级旅游景区、世界唯一杜鹃花国家森林公园、国家级风景名胜区。百里杜鹃风景区包括普底景区、金坡景区、戛木景区、花王景区和百合景区。暮春时节，杜鹃花竞相怒放，千姿百态，色彩缤纷，姹紫嫣红，绚烂花海形成一幅气势恢宏的画卷，在崇山峻岭间绵延百里，形成了世界上罕见的自然景观。普底景区和金坡景区是百里杜鹃最为核心的景区，普底景区主要有五彩路、红军广场、醉九牛、数花峰、云台岭等景点；金坡景区主要有凝香台、百花坪、锦鸡箐、马缨林等景点。每年的3—5月是最佳观花期，不同花形、不同颜色的杜鹃花在阳光的沐浴下，竞相绽放在枝头，红、粉、紫、金、黄、白交相辉映，置身林间花径，“花香醉游客，鸟语惊人梦”的山水之乐让人流连忘返。,2022-03-28,IP属地：未知
5分 超棒,M42****745,我们是4月2日去的，游客不是很多，满山遍野的杜鹃花，简直是美呆了。这次去百里杜鹃印象太深刻，不知为什么在携程上订的民宿，我们跟着导航走，既然把我们带到一个很小的村庄，那时候天又黑，感觉好害怕，后来直接倒车回来找路边的酒店住下，这个事情很纳闷为什么会出现这种情况，之前出游都是携程订的酒店或者民宿，从未遇到过类似的情况。,2019-04-12,IP属地：未知
5分 超棒,M27****1104,除了人太多感觉不错，杜鹃花太多了，目不暇接。如果明年的话气候好还要去，唯一一点就是停车方便，如果停在下面，10块钱座大巴车就上去了，很方便。,2019-04-08,IP属地：未知
5分 超棒,山在穷游,百里杜鹃风景区，除了大家熟悉的位于金坡等，景点以外，其实还有杜鹃花王以及戛木景区，目前只有戛木景区是免费的，其他的几个地方都需要收费，但是交通相对来说比较方便。因为我去的时间早了两周，造成了很多杜鹃花还没有开，留下了一些遗憾，今年的天气相对比较古怪，去年这个时候已经满山的盛开了。,2019-04-07,IP属地：未知
5分 超棒,竹内望,贵州西北部的大方县和黔西县之间的百里杜鹃风景区，是春天最值得去的赏花地儿。这里的杜鹃花是开在大树上的，满山的百年老杜鹃花树盛开时，可用壮美来形容。景区里有酒店和民宿，适合驾车去。,2021-05-22,IP属地：未知
5分 超棒,曹财神,满山遍野的杜鹃花，何止百里！简直是千里万里，一眼望不到边际。各种各样的花色。不得不感叹大自然的神奇和伟大。说他是地球彩带，一点不过分。,2025-04-22,IP属地：四川
4分 满意,M18****344,百里杜鹃确实漂亮，值得一去，但是，既然是五A景区，相应的配套设施差得不是一般，和五A的称号相当不配，住宿，停车，厕所，道路标识完全需要改进，希望越来越好！,2019-04-08,IP属地：未知
5分 超棒,金秀娴,百里杜娟真的太美了，漫山遍野的花，就是花的海洋，各种颜色的杜娟争奇斗艳，从下往上，从上往下都是拍照的好景色。可惜杜娟对土壤要求太高了，其他地方不能存活。景色不错，有趣好玩，总体超赞，性价比高，,2021-03-15,IP属地：未知
5分 超棒,贵州喜游旅行社专营店,这里是一个花海，原生态来的各种杜鹃花，没有人工打造的痕迹，花开距离有100多公里，每一年政府还会举办一次花圣节,2025-04-01,IP属地：贵州
5分 超棒,ghost0810,去的时候正好是杜鹃花海最盛的时期，整体没有让人失望。飞无人机很爽。但是人多的时候景区维护可以做得更好。小摊贩卖的东西千篇一律了。,2023-08-10,IP属地：上海
5分 超棒,gz当地向导伊妹儿,百里杜鹃风景区景色优美，风景宜人，空气清新，五彩缤纷，就像一幅幅天然的油画作品，美极了，适合拍照的好地方，令人耳目一新的感觉。,2021-03-20,IP属地：未知
5分 超棒,M46****0951,这个季节来看杜鹃花很漂亮，景区组织管理工作做得不错，工作人员配备充足，观光车师傅很热情，还要点赞的是人脸识别设备灵敏度高，大大提高了通行效率。,2025-04-18,IP属地：重庆
5分 超棒,匿名用户,超级漂亮，最好需要个无人机，景区很大，每个地方都有很多杜鹃花，赶上盛花期人超多，各个景点之间有大把车观光车，很方便，就是需要排队，堵车也严重,2025-04-19,IP属地：贵州
5分 超棒,三休同学,"超级美，超级值得去。
黔爽巴士可以预订往返大巴，火车站出发。
车程大概2、3个小时。贵州好多景点都是这样，坐着车走啊走啊走啊，七拐八拐突然进入一个桃花源一样的地方。
作为土生土长的北方孩子，从没见过这种漫山遍野开满花的场景，兴奋得不行。没想到景区里遇到的很多南方大叔大妈也好开心，路上时不时就会听到他们的歌声。
我去的时候赶上了小雨，依旧很美。
提醒一下，景区的木栈道和楼梯，遇湿会有点滑，很多人都摔倒了，千万小心。",2021-04-12,IP属地：未知
3分 不错,130****7631,这个景区应该算是比较特殊的一个吧，分金坡和普底两个景区，去之前到处看的攻略以及民宿老板提供的信息都不准确，最准确的方法就是开车到附近问警察问工作人员，两个景区相差15公里，金波景区还是非常有特色的杜鹃开了50%挺漂亮的，大家一开始都抱怨景区的景点名和车站名不能够统一，后来我们发现其实景区就特别小，偷偷地玩了两遍，普底普通的不能再普通了，杜鹃也没开几度根本不值得去,2025-04-16,IP属地：北京
5分 超棒,M37****0999,百里杜鹃，久负盛名，我来啦，杜鹃花真的是漂亮，山谷中漫山遍野全是野生的杜鹃林，五颜六色真美，但是好像金坡景区里面的步行道很多都废弃了，没有普底景区的步行道好，其他都还好，反正还是值得去看的，这独一无二的纯天然杜鹃花林。,2024-04-01,IP属地：贵州
5分 超棒,M44****6489,太美了，一定要来啊，拍照特别好看的哦，我下次还要来，这个话太好看了，在春日的阳光下，杜鹃花繁花似锦，宛如一袭华美的画卷，它们用独特的芬芳，向世界诉说着生命的奇妙和短暂，而我们，只需用心去感受这瞬息万变的美，便好……,2024-03-30,IP属地：贵州
5分 超棒,M52****297,这是第二次去，可能受去年干旱的影响，花开得不好。个人是非常喜欢百里杜鹃的风景！这么大面积的野生杜鹃花实属罕见，非常美！但金坡和普底两个景区分别收取观光车票和两个景区之间的交通费共计75元，不太合理。希望改进。,2023-04-17,IP属地：贵州
4分 满意,ghost0810,杜鹃花是很漂亮，但是各种门票分开来买真的好么，不能合并到一起么，买了门票进去还要买车票，换个地方继续买车票这有多麻烦，不能多为游客着想一下么,2023-04-10,IP属地：上海
5分 超棒,飛行野牛,利用一天的时间，从早上09:30到达百里杜鹃普底景区的西门服务中心开始赏花的行程，一直到下午的14:30从金坡景区的东门遊客中心出来，前后共计5个小时；当然我这次的行程係属於走馬看花，不是深度旅遊，主要就是在观光车的下车点附近看花，这样都得需要5𠆤小时，如果全程步行，估計需要3天的时间才能走完,2023-04-02,IP属地：贵州
5分 超棒,睿睿乖,实事求是的说，房间收拾得很干净，老板很客气，问什么老板问题老板都热心的回答，今年的杜鹃花开的不是很好，后面去的人，大家要注意普底景区，你们就不要去看了，没有什么花了，金坡景区的花海开得很好你们直接去金坡景区就可以了，再次感谢酒店的老板，谢谢你们的热情款待，下次再会，再次提醒下老板，一定要把电路弄好，弄得我们一晚上都没有睡好，老是跳闸，这只是一个小插曲，我相信以后会更好,2020-04-05,IP属地：未知
5分 超棒,带着檬宝去旅行,得缘来到地球彩带黔西毕节市，百里杜鹃风景名胜区位于贵州西北部，遇野山杜鹃百里，春分盛开映山红，满山遍野飘异香，姹紫嫣红特别好看。,2022-04-02,IP属地：未知
4分 满意,盘旋的鹰,百里杜鹃风景区今年门票本来130元因为疫情五折65元每人我们是3号上午去的人很少景区包含普底和金坡两个景区景区很大有电瓶车35元/人每到景点可以下车游玩到时又可以上车去下一个景点挺方便的。,2021-03-04,IP属地：未知
5分 超棒,M42****7641,"值得去，太值得了。
盛放的杜鹃花满山满坡，姚黄魏紫，花好看，花树好吃，花山好看；不仅仅是一场盛大的视觉盛宴，也是一场震慑心灵的精神洗礼。
景区服务有些问题，因为买票—退票—再买票，入景区时被拦住为难了一下，最后总算放行了，但心有不悦。",2025-04-14,IP属地：贵州
5分 超棒,M23****9243,非常值得去看看，百里杜鹃花海名不虚传，品种多，花色多，人也多😄😄，景色不错，总体超赞，去之前要做注意花期时间，我3月27日去金坡景区花期正好，普底景区花也很好，应该说时间合适，询问景区驾驶员，最佳花期观赏差不多一个月时间。,2021-04-11,IP属地：未知
5分 超棒,M23****9243,百里杜鹃花海名不虚传，真的值得去看看。附近酒店配套不足，去之前要提前订好酒店，不跟团的话最好自驾，各景点间的公共交通车少，时间点要把握好，我们3月27日去的，金波景区的花期正好，太美太壮观，普底景区面积比金波景区更大。,2021-04-11,IP属地：未知
4分 满意,吴立珍,贵州百里杜鹃风景区是迄今为止中国面积最大的原生杜鹃林，百里杜鹃以此得名。在长约50公里的狭长丘陵上，分布着几十个品种的杜鹃，景区是彝族和苗族聚居地，花期是好几个少数民族节庆的日子，可以看到丰富多彩的民族风情表演。,2020-06-01,IP属地：未知
5分 超棒,老鬼,早上8点直接从贵阳到大方百里杜鹃花景点，2个小时的车程。因为开车去到得比较早。景点门口人也不多，疫情防控期间工作人员检查比较严格。提前一天在携程旅行网购买的门票也是半价。通过携程APP预订非常方便快捷，门口手机验票就进去了，乘坐摆渡车开到各个景点位置。观赏的时间充足，一处一美景让人流年忘返，满上遍野都是花，虽然今年花开的不太是茂盛，也能让人身处花海其中。第一次玩感觉杜鹃开花很大。总体来说非常满意。下次有时间选择季节再去。,2020-04-16,IP属地：未知
5分 超棒,201****551,网络订票，无需换票，刷身份证入园，方便快捷。疫情期间，景区半价优惠。普底、金坡景区通用。观光车票另购，网购与现场购买是一个价。景区范围广，有必要购观光车票。每年的花期会略有不同，希望网购时有相关信息提供。,2020-04-05,IP属地：未知
3分 不错,M26****115,"我们是4月中旬去的，为了去看杜鹃花，特别选择了毕节。但是，个人感觉不是特别好，应该是这一个月游玩来说，不算好的体验。
我们住在黔西老车站，一早晨坐大巴过去，来回的行程3个小时，游玩1小时。而且，花基本上都没有什么了，可以算是淡季了，里面也没有什么游客。门票130+30电瓶车，总之160，感觉很不值的。上图，大家看看吧。",2019-04-23,IP属地：未知
5分 超棒,M48****913,不止是一树一树的花开，而是一山一山的花开。真正的花海！4月11日去的，成功避开清明的人山人海，但金坡有一些红杜鹃已过花期，普底还行。逛金坡时，正赶上天阴欲雨，雾气时聚时散，拍出来照片，倒比阳光灿烂下好看。,2019-04-18,IP属地：未知
5分 超棒,乐乐嘻嘻哈哈,五一people montain people sea的景观吓到我们了，想起那年去毕节的杜鹃风景区（当然并不是五一），真是开心。因为人非常少，就象整座山都是我们的，哈哈。不过去这个地方，本身路途是有点远。,2019-05-06,IP属地：未知
5分 超棒,_WeCh****574269,值得大家去观赏，漫山遍野的杜鹃花太美了，不过一定要选好花期，百里杜鹃分两个景区，金坡景区和五彩路景区，门票可以通用，如果时间足够一定要游完,2019-04-03,IP属地：未知
5分 超棒,Yomi_Lee,在杜鹃盛开的时候去，真心不错👍🏻，没见过碗口大的杜鹃，友情提醒：里面当地人摆摊的松子千万别买，买了200大元，回来全是变质的，他当时抓给我们试的就是好的,2021-07-01,IP属地：未知
5分 超棒,匿名用户,风景这边独好！许多的古树漫山遍野，鲜艳的花朵争相开放，各种颜色的花布满山坡，惊艳惊艳！！！,2024-04-14,IP属地：贵州
3分 不错,怀念大鱼大肉,春日里来到大方当然是要来看看这百里杜鹃花啦，确实是一大片一大片，漫山遍野都是，走在花丛中，天下第一的自然花园，门票100。值得。,2019-09-12,IP属地：未知
5分 超棒,M38****3659,还是很壮观的，周一大早去索玛花桥就很多人了，园区里面很多人飞无人机，景区太大，带娃还是很辛苦，只逛了金坡，没有逛普底，住在石牛小镇，吃的推荐炒菜黔香阁，盘县铜锅牛肉,2021-04-04,IP属地：未知
5分 超棒,wuli民律偶吧,百里杜鹃花，非常壮观！今年可以一票玩3天所以我金坡和普底用两天时间玩，非常轻松，但两个景点都要一早去人比较少，玩得特别过瘾，下午去花王奢香古镇。,2021-04-03,IP属地：未知
5分 超棒,匿名用户,"值得专门前往的景区。

盛花期真的超美，有的景区说花海是个形容，但百里杜鹃是真的是片杜鹃海。

普底景区更大一些，金坡景区网红元素更多一些，各有特色。但是两个都特别大，整个逛下来要一天时间。",2024-04-08,IP属地：北京
5分 超棒,小小来自哈哈星球,漫山片野的高山杜鹃花，置身于花丛中，特别好看，对广东人还特别友好，今年2019年还在免票政策内，毕节的多个景点都是免费喔！,2019-04-15,IP属地：未知
5分 超棒,e06****23,"普底景区的杜鹃目前还是蛮壮观的。
游览路线：自驾游的话建议从南门进，停车场非常近。走最少的路到检票口。
游览时间：看到大家都说排队问题。建议下午4点左右进，这样不会太晒，同时错过旅行团大军。也不会排队。轻松进入核心景区。或者早上最早时间进园。",2025-04-25,IP属地：山西
5分 超棒,悠悠春妮,百里杜鹃名符其实方圆百里的野生杜鹃，很漂亮很震撼。本次去了金坡和普底两个景区，普底今年花开的不太好，相对金坡海拨高点，但景区相对更平坦，步行舒适度更好。金坡游客太多，观花，拍照体验感差一些。金坡观花景点太集中，游客太集中。,2025-04-23,IP属地：四川
5分 超棒,jellytt,我们是周五下午3:30到的京坡景区步行到的第一个观景点，一直玩到下午7:30离开景区，其实4:00以后这个景点的人就不是特别多了，而且下午夕阳还是挺漂亮的。第二天上午游玩的普底景区下午又回到金坡景区玩第二个观景点，总的来说金坡景区的两个观景点花都开的比较好，普底只有五彩路那个景点观赏价值比较高。,2025-04-19,IP属地：贵州
5分 超棒,D73****17,"4月16日，领略了一次什么叫漫山遍野。由于赶早，大半天（7点20-14:30）完成。丝滑的畅游了金波和普底两大景区。
​领略到景点的诚意满满，高铁下来就有直通车。人满走，一趟高铁下来基本不用等。景区热情的工作人员无处不在。
​正值盛花期，应该还能维持一段时间。对于我确实是一场视觉盛宴。惊叹大自然的美丽。",2025-04-17,IP属地：贵州
5分 超棒,lly68,我们是4月15号去的，从贵阳自驾2个多小时，从普底景区进去。首先，停车的地方距离景区入口有一定的距离，其实靠近景区入口的停车场有位置，但早在前面就拦截了。由于没有坐景区的电瓶车（车费70元），我们走着进去，大约遇步行十五分钟才到景点。毕节的百里杜鹃我们虽然只看了非常小的局部，但仍感觉它的规模非常宏大，绵延起伏的丘陵土坡上是各色野生杜鹃，红的、粉的、紫的、月牙白的，可惜我们去时花期已经进入尾声。,2024-04-20,IP属地：广西
5分 超棒,M26****8134,"还是值得去一趟，第一天住西门游客中心，坐定点车10元到普底景区的五彩路，再换乘电瓶车，游览结束再乘定点车返回西门游客中心，注意，去的时候坐的1号定点车，返程时还是要坐1号车定点车。

从西门游客中心可乘坐定点车40元至金坡东门游客中心，我是从西门游客中心自驾到金坡东门游客中心的，很方便，不过要早点，时间晚了盛花期可能受交通管制，不许自驾。",2023-04-08,IP属地：四川
5分 超棒,甘曜菘,"贵州毕节的百里杜鹃景区，是世界上最大的杜鹃花园，在这里，看漫山遍野的杜鹃花，在这里，看繁花璀璨，就是一件颇为美好的事情。
百里杜鹃景区中分为金坡、普底等几个景区，每个景区都有着不同的风景，花桥或是观景台，在杜鹃花海中都是极美的景致。
在这里拍照，更是随手都能拍出美美的照片，色彩缤纷的杜鹃花，就是最好的拍摄背景。总体超赞，",2021-05-19,IP属地：未知
5分 超棒,胜利8188,百里杜鹃景区实在罕见，各种颜色的杜鹃花争香夺艳让人留连忘返，到了贵州不去百里杜鹃景区，实属可稀，每年的清明前后是观景的最佳时间，错过这个时间段只能等来年，所以清明前后景区人山人海，这里的杜鹃朵大，颜色全，是我有生以来见过最美的杜鹃花，值得大家来观赏。,2019-06-21,IP属地：未知
5分 超棒,老老倪,百里杜鹃风景区位于贵州省毕节市中部，宽1~3公里，长50多公里，囊括了世界杜鹃花5个亚属的全部，誉为“世界上最大的天然花园”，享有“地球彩带”美誉，每年3月下句到4月上句，各种杜鹃花竟相怒放，漫山遍野，千姿百态，铺山盖岭，五彩缤纷。,2019-05-18,IP属地：未知
5分 超棒,gz当地向导伊妹儿,百里杜鹃风景区是观杜鹃的好地方，各种颜色的杜鹃美极了，视野开阔，满山遍野，趣味性强，原生态自然风景，令人心旷神怡，流连忘返，拍照的好地方。,2021-03-30,IP属地：未知
4分 满意,幸福人生LOVE,百里杜鹃里的杜鹃花非常漂亮。我们是在3月末去的，杜鹃花开了8成。游客很多，各种颜色的杜鹃花真的好看。普底和金坡景区两个地方的杜鹃花差不多。,2019-05-03,IP属地：未知
5分 超棒,谢凤芸,百里杜鹃是地球上最大的天然花园，赶上最美花期，遇上难得阳光，简直美醉了，让人流连忘返。门票三天有效，三天可以无限次免费进入景区。景区可以看到很多穿民族服务装的本土游客，为景区增加靓丽的风景线。,2024-04-13,IP属地：四川
5分 超棒,老少皆宜（程世荣）,每年的三四月份都是贵州大方百里杜鹃花盛开的季节，也是游客来这里观赏杜鹃的最好时节。百里杜鹃景区的季节性很强，如果要赏花就春天来这里。,2023-04-26,IP属地：北京
5分 超棒,zy1263,和普底景区相比，金坡景区的杜鹃花品种更多，花朵更大，景观更好，体验更舒适。即使今年金坡杜鹃开得不如人意，索玛花桥还是深深吸引住游客，马樱林的杜鹃红似火，每当观光车驶过，又是响起一声声“哇……”,2023-04-12,IP属地：贵州
