评分,用户,评论详情,日期,IP位置
5分 超棒,秋姐在路上,观山湖区一个很大的生态公园，景点多，有个很大的湖，可以去转转。,2020-01-07,IP属地：未知
5分 超棒,_CFT01****0530134,顾名思义，就是围绕观山湖修建的公园，环境好，适合跑步，跑步。,2023-03-31,IP属地：贵州
5分 超棒,纵横天下,气候宜人，环境优美，体育健身，推荐好去处,2020-09-10,IP属地：未知
5分 超棒,匿名用户,除了大庙会，还有游园灯会和幻乐灯会，挺好看的，有吃有玩。,2024-02-08,IP属地：贵州
4分 满意,bj_cqht7h,观山湖公园免费开发，景色宜人，环境干净优美，健身步道和健身器材设置方便，是锻炼、亲子游的好去处。,2019-04-12,IP属地：未知
5分 超棒,与人为善有容乃大,贵阳市的新区，新的公园，新的乐土。,2022-08-10,IP属地：上海
5分 超棒,芳华有尽，行者无疆,这是新建的一个比较大型的市政公园。,2022-08-06,IP属地：广东
5分 超棒,落落陌上桑,公园比较大，在几个楼盘中间的休闲公园。周末遛娃好去处。,2021-10-08,IP属地：未知
5分 超棒,zhongyan2,观山湖公园是一个休闲的地方，可以慢跑，游玩，景色很美。,2020-04-05,IP属地：未知
5分 超棒,云子如风,赏美景，早锻炼的绝佳去处。赞一下!,2019-07-27,IP属地：未知
5分 超棒,zhongyan2,观山湖公园打造的非常漂亮，可以慢跑，散步，景色很美。,2020-06-02,IP属地：未知
5分 超棒,快给我核子可乐,公园位置优越、空气清新宜人、景色十分优美，推荐前往！,2020-01-05,IP属地：未知
5分 超棒,M35****280,观山湖公园真的好大，在贵阳市的中心。非常值得一去。,2023-09-15,IP属地：贵州
5分 超棒,198581x,贵阳难得一见的大公园，景色非常优美，出片效果很不错,2021-12-14,IP属地：未知
5分 超棒,320****139,值得游玩，自然环境占比大，塑胶跑道上跑步🏃爽 爽 爽,2020-07-03,IP属地：未知
