评分,用户,评论详情,日期,IP位置
5分 超棒,andylinda,影视城建筑面积16万平方米，一条中轴主线贯穿整个影视城最长达790米，最宽处近530米，皇宫区建有未央宫、长乐宫、瑶池、祭坛等皇家林苑，外城区以长安街、朱雀大街、府邸大街为主要街道，沿府邸大街建有三大王府：衡山王府、大司马将军府、淮南王府。街区分布有公主府，县衙、监狱，皇家马厩等。商业区有东市、西市，乐坊、客栈、酒楼、各式民宅分布其间。,2024-11-06,IP属地：贵州
5分 超棒,hyacinthydzh,"临时决定在都匀住了一晚，第二天去影视城看了
看，儿童免票需要交10元保险钱，不理解这样的
景区会有什么危险隐患。不追星不追剧的纯属瞎
逛，陈情令，庆余年，星汉灿烂都在这里拍摄。
每个宫殿很大，里面是空的，还有开着电动车逛
的，看来里面挺大的，我们没走多远。门口有消
费集章的地方。",2024-08-05,IP属地：贵州
5分 超棒,M29****905,追着陈情令打卡来的，适合拍照，很多地方还在修，很多建筑垃圾；逛起来真的热，晒，夏天防晒一定要做好，不然就像我，黑白分明了，自驾跟着导航很方便，周边吃的不多，城里面有几家小吃摊，没吃过不知道味道怎么样，,2019-08-21,IP属地：未知
5分 超棒,绯琦,评价：交通便利都匀市内乘坐22路或者茶博园专线就可到达，宫殿城墙雄伟壮丽风景宜人，景点内附属游乐设施齐全，商家商品花样繁多。可以在城内吃到都匀特色小吃味道回味无穷。毛尖小镇和杉木湖就在附近风景也是没的说可以一起游玩一遍，最重要的是现在还不收门票！！,2018-09-17,IP属地：未知
5分 超棒,湘西妮妮,五一节去的，人不多，可以在里面慢慢玩，成人60一张票，一进门就有汉服出租包化妆，有单车出租，里面的工作人员都穿汉服，不同时间段有不同的表演。在里面可以玩一把穿越之旅，小型的横店，不错，值得一去。,2019-05-03,IP属地：未知
5分 超棒,niuniubaba0203,"绝对是值得一游的地儿。众多影视剧拍摄地，规划很好，节目有趣，拍照神地。服务好，停车场超大。
【景色】市区边，交通便利，群山环绕。",2024-10-10,IP属地：江苏
4分 满意,Tokki009,为了陈情令，特地跑来玩的。从都匀东打的士30元，走的时候在门口坐22路到都匀客运站，影视城门口站牌只有茶博园专线，但22也停那里的！入口附近就汉服出租，穿着汉服在城里逛，好有穿越感。挺好玩的！不过如果不喜欢拍照，的确没什么好逛的！,2019-10-05,IP属地：未知
4分 满意,_WeCh****541324,"里面很大，真的是逛得jio jio痛，而且不是那种古城一样普普通通，是真的在深宫大院的感觉，进去感觉自己就是走进了电视剧里的古代宫廷一样。还是挺不错的，但是现在还没完全修好，感觉还有好多地方在施工，估计以后会修的更大吧。
最后，我其实是陈情女孩来打卡的",2019-08-27,IP属地：未知
5分 超棒,籽薇,去都匀出差，随便去了影视城游玩！真心的壮观！新修的太适合拍照臭美了！居然还不要门票，哎哟太值了！不多说直接上图！我们去在下小雨，如果是太阳天肯定更美,2018-12-10,IP属地：未知
5分 超棒,Migo1106,为了阿令特意飞过来玩，定了同款毛尖酒店，影视城离得很近。入园无需换纸质票，只要出示订票二维码跟贵州健康码就行，在大结局山顶下来已经4点多了，吃了馄饨张，多谢老板借我们打卡指南，让我们用45分钟就找到了全部地点~园区不太大，仔细逛也大概只要2个小时左右吧。设施很齐全，就是离市中心太远，没有车的话不太方便。体验很好，,2020-09-18,IP属地：未知
4分 满意,谭天扫雪,可以坐22路公交车或者茶博园专线到景区门口。我们是最早进园的，没几个游客，边走边拍，逛完整个园区大概花了两个小时。感觉整个园区缺乏一种生气，好像来到一个无人的世界。室内也没有陈设，空空荡荡的。如果园区能增加些表演节目，就更好了。,2020-08-02,IP属地：未知
5分 超棒,江沉鱼,"赶在陈情大结局之前去了一趟拍摄地。
        一直觉得魔道我真的是有心结的，注定终究是书外人这一点让我有段时间真的是难受得不行，很感谢阿令让我有那么一点点，哪怕一点点觉得和它的距离好像近了一些。虽然自己心里的界限依旧清晰，魔道是魔道，陈情是陈情，但左右得到了一点慰藉。
        而我是有悔的，悔没有更早，早在拍摄的时候就去看看，一是离哥哥们更近一点，二是那样真的会有一瞬间让我觉得置身在魔道的世界里吧？但是还好，一切都没有错过就好，所幸我遇到了那么好的哥哥和迪迪，作为我的光一直存在着，很好。
        然后这次去也更加觉得阿令真的是超级用心了，布景和后期真的优秀，实在是找不到很多的词藻去夸赞一番。在瀑布那边，那条路是真的很难走的，蚊虫也是扑面而来的多，阿令还有哥哥们辛苦了真的，在这里对他们致以最崇高的敬意。
        问值不值的人，是你们不懂哈哈哈无语，不论烈日当空，但一步步去走过哥哥们走过的路，真的是世界上最幸福的事情了不是吗？
       这个夏天，感谢陈情的陪伴，谢谢你带给我们的所以惊喜和感动，永远爱阿令！
            
                                  ——致世界上最好的阿令",2019-08-30,IP属地：未知
5分 超棒,E11****673,"人不多，遇到的还基本是令牌…
进门就遇到剧组拍戏，碰到好几个剧组，偷偷拍了一点。
里面是秦汉影视城（陈情令），汉唐影视城（庆余年），很大 可以租车慢慢蹬，別有一番趣味。",2020-08-13,IP属地：未知
5分 超棒,M15****575,打卡陈情令取景地 如今已经很多都看不出来了 整体一般 景区规划也一般 这个季节人也很少 不过倒是悠闲安静 可以慢慢的细细的看 找一下他们的足迹 大殿维修 比较遗憾 应该会再来 毕竟爱陈情令爱的深沉,2020-11-15,IP属地：未知
4分 满意,Ayuzuru彬萌萌在瑞典,都匀最出名的景点，多部有名电视剧的拍摄场地，比如：陈情令、庆余年等。景区面积很大，到处都是租服装的，不少年轻人过来打卡。60元门票，60岁老人以上免费进场。,2021-09-02,IP属地：未知
3分 不错,M27****1373,很多都是追陈情令来的，但是千万不要上里面商户的当，一把陈情令的笛子卖四五十块钱，网上我看了才十几块钱，尤其是司马门下的一个大叔商贩，我被他骗了，大家千万不要去听他胡说八道！看陈情令的取景地，直接去祭坛那边就可以了🤣,2020-06-28,IP属地：未知
5分 超棒,m42****4076,超大，建筑很美，去的时间有点晚，没什么人，听说六点关门，玩的有点赶，很多建筑没来能进去逛仔细，早知不用租单车各个房子相通的，逛着反而看更多景色,2020-09-02,IP属地：未知
5分 超棒,俺家小宝贝月亮,空间其实很大，不过可能由于近期没什么大制作去拍，导致很多景观略显破旧。推荐两个人以上前往，这样找角度拍照，一个人自拍还是显示不出效果。而且不用自带汉服，里面好多租汉服的，各式各样，更方便很合适。,2023-07-18,IP属地：福建
5分 超棒,觉察入微,体验很好，景色不错，值得推荐，。陈情令打卡去的，下着好大的雨。舍命游玩。还打卡吃了哥哥弟弟的套餐，满意的很。最喜欢祭坛和大殿的形式。,2020-08-21,IP属地：未知
5分 超棒,320****298,很喜欢秦汉影视城，下次有机会还来，视频为证,2025-02-02,IP属地：贵州
5分 超棒,匿名用户,景区很大，人不多，各种影视场景打卡，最好玩的就是怪诞奇幻夜活动，沉浸式体验鬼市、冥天子选妃、僵尸跳下高台那一下冲击感太强了，舞姬小姐姐跳舞很美，NPC小哥哥好好看,2023-08-24,IP属地：湖北
5分 超棒,雪舞依依,孩子要来玩，到后确实像其他发的斥具资修的，打卡许多网红点，放暑假来玩但人不多，皇宫外观确实修得不错，一些景点门开起里面黑的但是是原拍戏点，总体修得很好，适合古装拍，很出片，无人机拍更能拍出感觉，建议晚上搞“鬼”活动，就看到人人人...好多，我都不赶呆太久，典型扎推、无口罩，影视城应规划下。,2022-07-17,IP属地：未知
4分 满意,m28****8917,景区总体还可以，但是里面的贤王府（一个拍照的地方），价钱都不说他贵了，我就不知道他拍的什么玩意儿？这四张180，我老爸非要给我妹照，摄影师很不负责，一边玩手机一边照很厉害！大家千万不要去那里拍照，可以自己租衣服到外面自己拍比较好！下面有对比照！①③是贤王府摄影师拍的，②④是我自己拍的，无滤镜无p图,2020-08-22,IP属地：未知
5分 超棒,yuntianling,地方很大，二期还在修建，过节的时候还有表演，可以租车，挺方便的，各个影视剧打卡景点，而且老人小孩都免票，成人才60，很实惠总体超赞，,2021-05-02,IP属地：未知
5分 超棒,m22****091,其实就是看看仿古建筑而已，没多少乐趣，外地人门票贵一半，之前我以为只是都匀当地人才优惠门票价，其实黔南州的全部县市都优惠。,2019-08-06,IP属地：未知
3分 不错,M45****0416,"我们购买的是套票599的，看起来有很多的项目感觉很划算，其实还是觉得不怎么值得的。分类给大家说说吧！
一、秦汉影视城
套票里包含了门票，秦宫汉宴，汉服体验一小时。先从门票说起吧，在预定之后有工作人员打电话给我们说了一定要取纸质门票，到了影视城去取票的时候窗口一个年轻小妹妹说不用取纸质门票，直接刷二维码就可以了。（我还特意强调了是套票）然后我们去排队后检票人员又说必须要纸质门票，所以我们来回折返了两次。在这种闷热的天气心情难免有些浮躁，加上这些琐碎的事情让接下来的旅途不怎么期待。接着我们说说秦宫汉宴，吃的没什么毛病，只是感觉不正规！就餐的餐桌被旅客坐，还有调皮的小朋友去踩，这是唯一不好的一点。再说说汉服体验，套票里是免费的一个小时，我只想说这一个小时租好后还要去梳妆发就浪费了很多时间，可能妆发做好了都只有半小时的时间了。拍照的姐妹就不得不选择自费80元租不限时的汉服。当然，妆发是另外收费的。影视城很大，工作人员极少，想问路都找不到人，即使有工作人员态度也是极差！！地图在进口的时候也没有，还是我们去存放行李时偶然发现的
   字数不够了，等我看看能不能追评！等我！",2021-10-06,IP属地：未知
4分 满意,🌹岁岁年年🌹,都匀的秦汉影视城已成为当地一景，占地面积大，其中的亭台楼阁仿造得有质量，蛮逼真的。平时去参观的人不多，节假日就很热闹了。去的时候还遇到了正在拍电视的场景。,2020-03-12,IP属地：未知
4分 满意,匿名用户,交通方面，自驾游可以停在景区停车场，很方便，网上买票直接刷身份证进去。暑期门票半价加保险63一个人，因为我们是下午两点进去的，是真的热，除了部分室内。范围还算比较大，如果像我们一样昨天在黄果树等景区暴走了的，建议租一个电动四轮车，可以坐4个人，随便哪里都可以停车，一小时80元，超过10分钟算一小时，这个需要注意。这段时间没什么剧组拍戏，部分设施建筑有点破损和陈旧，但是还算干净。这段时间景区一天有个节目表，大概十几个节目，有兴趣的可以看看。来这里最适合喜欢古装汉服什么的打卡拍照了，还有就是影视剧地点打卡。景区里面外面都有卖小吃和饮料的。,2023-08-15,IP属地：贵州
4分 满意,匿名用户,因为这里是陈情令拍摄地，所以专程来看看。都匀的空气真好，水水润润的。影视城虽然不是特别大，但走着也还是有些累，园里可以租电瓶车，还挺方便。,2025-05-07,IP属地：北京
5分 超棒,300****278,满满的回忆，因陈情令而来，司马门下卖纪念品的工作人员，多才多艺。会再来的。秦汉食客来的炒饭赞爆了，馄饨张也要打卡，陈情令馆，梦回2019年那个夏天。,2023-04-04,IP属地：贵州
5分 超棒,杀青快乐,主要因为是《陈情令》《星汉灿烂》《双世宠妃》的取景地，所以想去看看，打一下卡，但是去了之后发现影视城很大，建筑也挺好看的，拍照很出片，进门右手边的馄饨张的油泼面和臊子面不错，很好吃😋而且店里有肖战和王一博的周边装饰和签名,2024-04-10,IP属地：贵州
5分 超棒,小乖小乖小小乖,51出游，原计划是直接从贵阳到苗寨，临时决定来影视城看看。虽然完全是人造景点，但是整体感觉不错，面积很大，有很多小吃，穿汉服的小姐姐很多，但是提个小小的建议，相比于其他景区，这里的旅拍规模还是不大～,2023-06-29,IP属地：四川
5分 超棒,遇见，博肖,为了王一博肖战饰演的陈情令打卡去的，里面有很多陈情令的场景，离都匀东站比较近，里面也比较大，好多穿汉服的小姐姐，汉服和影视城真的跟适配！,2024-08-19,IP属地：湖南
5分 超棒,莫挨老子。。,总体超赞，,2021-06-09,IP属地：未知
5分 超棒,_WeCh****92740,拍照很不错，景区很大。里面环境干净，还有些再修。可以有活动的时候再去,2023-07-13,IP属地：贵州
5分 超棒,匿名用户,西南地区最大的影视城，气势磅礴，国庆节去的，门口的青年志愿者指导购票，很有耐心，享受免票的只需要买5元保险费，如果不买就去售票窗口签个字，我们懒得走路，就买了保险，里面的有些场景看着就是眼熟😃😄影视城里面很多旅拍的人，男男女女，男女老少，场景确实不错。,2024-10-04,IP属地：重庆
5分 超棒,珮宝宝,都匀秦汉影视城距离都匀市区有10多公里，可以坐22路公交车直达，还是比较便利的。影视城内有多个仿秦汉的建筑群，其中仿秦汉时期修建的皇宫规模宏大，值得一看。影视城内有多个换装汉服的服务商家，换装后拍照更容易出片。影视城内还有射箭、骑马等收费娱乐项目可以选择。此外，影视城内定时有演员演出不同节目，还是值得一看。门票方面，在携程购买影视城门票价格更实惠，进影视城需要亮码验证，也还是比较方便的。,2024-08-22,IP属地：贵州
5分 超棒,M37****4081,都匀发展得太快了，到处都是高楼大厦，马路修得象飞机跑道一样，就象个公园城市，车开在路上一点都不觉得累，赏心悦目，一会就到了，门口停车场超级大，车山人海！大部分都是外地客，看车牌就知道，五花八门，进去就穿越到了秦朝，出来就回到了现代，很有意思，很好玩，到处都是穿着汉服的女子，金盔、金甲、手拿红樱枪的士兵，带刀侍卫，锦衣卫，文官、武官、其实都是游客装扮的，给那些心怀演员梦的人过把瘾。,2023-08-17,IP属地：贵州
4分 满意,M14****929,如果是第一次来的游客还是非常值得一看的，里面的建筑呈现了电视剧里秦朝和汉朝的场景，进入景区仿佛置身于电视剧中。不足之处就是还有很多建筑没有完工，不能进去参观，玩得不够尽兴，比较遗憾。交通也是一大问题，不是自驾来的游客，连打车都比较困难，希望景区能够慢慢解决交通问题。,2020-11-12,IP属地：未知
3分 不错,M31****4604,秦汉唐影视城。但是宫城主打汉宫，和秦唐宫城没得啥子关系。而且里面没得什么玩的，建筑粗糙，丝毫感受不到历史的大气磅礴，有的只是国产神剧的烂。,2020-04-19,IP属地：未知
5分 超棒,118****749,西南最大的影视基地，领秦汉文化风采。,2025-04-07,IP属地：贵州
4分 满意,mil****irl,人不多，很多游客还是因为陈情令来打卡的，包括我。景区的营销非常值得改进，应该把每个场景拍了什么电视剧标注出来，这样更利用营销及吸引游客。,2020-10-06,IP属地：未知
5分 超棒,一棵会跳舞的水手,还可以，过节活动很多，拍照比较漂亮，但里面比较大，要做好能走路的准备，全程靠走，里面很多服装租的，完全可以在里面化妆，换衣服拍照附近,2024-02-11,IP属地：贵州
4分 满意,吴立珍,都匀秦汉影视城面积挺大，可以来一次穿越，拍古装照，自娱自乐，乐在其中。这里有古代大户人家、官场衙门、市井街巷，还有高大的城门，有巍峨的宫殿和庄严的皇宫。,2020-05-29,IP属地：未知
5分 超棒,M15****753,淡季不热闹，我是来找庆余年的，哈哈，最后几张图分别是“监察院大门” “牛栏街” “郭保坤家门口”“北齐皇宫““庆帝宫门口“。因为带了孩子，总不能我自己一个人玩，还有好多地方没找。最后，租衣服，贵,2023-04-10,IP属地：湖北
4分 满意,秘鲁忽必烈,国庆长假第二天去玩的，秦汉古城影视基地，拍摄过将夜，陈情令等影视作品。本人也没去过其他影视基地，所以觉得这里很不错很大很宏伟。停车费5元，能接受。可住对面的毛尖酒店。,2020-10-02,IP属地：未知
5分 超棒,niuniubaba0203,非常值得一游，秦汉城。现在开发了夜游，更是别具一格。传说中的庆余年馆，应该开辟一个主题院落，周边产品和剧照资料，是现代穿越剧的天花板吧。其实还可以一剧一院落，把周围的建筑都利用上。,2024-10-07,IP属地：贵州
4分 满意,M57****1565,就很遗憾，你能体会到，期待了一个月，好不容易有空了，打车来回四十，从一点等到五点半她说由于下雨夜场取消，的那种落寞感吗，而且下次来，就不一定是我们四个一起了，就跟遗憾，但不得不说很多店家都很热情，耐心好，服务也好，就是没有雪糕，有饮料，懂得都懂，景区的东西相比较贵一点，很正常，除了下雨带来的遗憾，我还是很满意很喜欢的,2023-08-07,IP属地：贵州
5分 超棒,旅行和美食不可辜负,第一次去是冬天，小朋友租了汉服拍照，特别高兴。这次去天气很好，小朋友们又租了不同的汉服，开心得很。五一期间人不少，但场地大倒也不挤，据说有夜游活动，下次来试试。,2023-05-09,IP属地：贵州
5分 超棒,jewelna,"感觉这是2021年最后的一次长途旅行🧳
马上2021年就要过去 这一切都即将成为过去
回忆一下 其实还是挺不错的
喜欢景区里面的张馄饨 还有国货品牌护肤品
租汉服拍照的小妹妹的真的很仙
假期里面还有现场表演节目
穿越时空的时候才发现我穿的现代裙子👗",2021-12-29,IP属地：未知
5分 超棒,LIONKIKI,收门票55有点贵，说实话，拍戏又拦着不让看。房子里面没有装饰，如果拍艺术照可以，如果游玩有点贵乐，去过横店，感觉这个需要好好打造几年才行。,2019-02-14,IP属地：未知
5分 超棒,car****eq,景区比较大，里面有租服装的，还有电瓶车可以租用，穿古装照相是必备了。表演节目一般，小吃就几家，电视剧拍摄打卡点标识不是很清楚，有陈情令馆、庆余年馆，都是剧照贴墙上，感觉一般般。最近晚上有鬼市可以逛,2022-08-06,IP属地：四川
5分 超棒,M21****900,非常棒的一个景点，全部是仿秦汉时期的建筑风格，最为震撼的是未央宫，非常大气，老人喜欢，带上孩子刚好可以把历史代入现实，门票也合理，老人小孩五元一人，成人60多，吃的也不贵。,2025-05-06,IP属地：云南
5分 超棒,椒Young,景区交通和停车都很房产，适合带家人一起去逛，我们是晚上去的。里面表演很多，不知是不是因为晚上的原因，商业化气息没有那么浓，挺棒的！,2023-09-08,IP属地：四川
5分 超棒,微微一笑,面积巨大，交通还是便利，可以自己开电瓶车，就是费用有点贵。里面有很多的影视剧馆可以参观。还有馄饨张可以吃东西的地方，也是陈情令肖战一博常去的点。,2024-08-29,IP属地：广东
5分 超棒,118****749,有非常好的秦汉风采体验。演出节目丰富多彩。,2025-03-23,IP属地：贵州
5分 超棒,匿名用户,"秦汉影视城评论
来秦汉影视城玩，体验太棒啦！这里规模宏大，仿古建筑依史料建造，完美还原秦汉皇都风采。漫步其中，仿佛穿越千年。我还找到了《陈情令》《庆余年》的拍摄场景，影视氛围拉满。景区配套完善，工作人员服务热情。强烈推荐大家来感受这独特的历史与影视魅力！",2025-04-08,IP属地：贵州
4分 满意,M25****6760,景点还是很不错，只是有点破败，游客不多，只有主殿有人游玩，里面的体验项目太少，且价格有点贵，很多景点进去不了，建议自行带汉服进去，里面租汉服很贵，不过汉服妆造还是很好看，我们两个女生，两个男生，我们男生是自己带的汉服过去，没有化妆，女生租的汉服，有妆造，两个女生画的很好看，就是价格也美丽，嘿嘿。,2024-10-01,IP属地：重庆
4分 满意,酷酷又不甜的呀哈尼酱,玩的夜场，六点多进去，对秦汉宫一块浏览了个门口，主要是参加了怪诞夜市，看表演，看鬼间烟火，人流量很适中。为了把节目看完，硬生生在里面玩了3个小时。。。有条件的进景区一定穿古装，照相好看。景区里面租衣服有点贵，普通古装90块一套，稍显豪华128一套。,2023-08-01,IP属地：贵州
5分 超棒,iri****ala,附近可能景点不多 国庆节停车场都满了。天气很好风景不错。景区不大但是景点密集。如果是打卡的话，每个地方都是一个点。登高天气好的话可以看到远处的山和蓝天白云风景特别好。去的时候金陵台在装修。可以慢慢逛，有很多小吃，但是还是馄饨张最好吃。晚上也有活动。还有个鬼屋。反正这个地方你可以随便发神经因为大家都是自己人🐢 有趣好玩，景色不错，性价比高，总体超赞，,2020-11-09,IP属地：未知
5分 超棒,118****749,秦宫殿大气上档次，演出节目好看太棒了。,2025-04-01,IP属地：贵州
5分 超棒,118****749,领秦汉风采，学秦汉文化，非常好的体验。,2025-03-16,IP属地：贵州
4分 满意,匿名用户,"缺点：就是只有门口有几家吃的和卖纪念品商店，表演也就是快闪模式，门票完全不值得这个价，
优点：还是值得来看一次，修的规模挺大的，很有回到了古代的感觉，适合穿汉服拍照打卡，留恋，但是不会让人想再来一次了",2023-12-19,IP属地：贵州
4分 满意,_WeCh****839776,想看下拍戏的地方可以去看看，春节收门票，听说日常不收的，如果天气好还可以试着穿汉服拍照，总体看建筑和外景，房里内饰没什么东西，有些地方拦着不给进，估计是拍戏点,2019-02-13,IP属地：未知
3分 不错,沉浮有礼,如果只是想看看，建议你不要来了！这里主要是拍摄地点，小盆友拍照的天地（汉服）！走了一圈，无聊死了！,2019-02-07,IP属地：未知
4分 满意,M19****896,园区挺大，租了电动车也不太费劲，就是价格相对较贵，80一小时。里面很多不同的区域，但最大的一个宫在修缮进不去，喜欢看电视剧的来打个卡还挺有意思的。还有一些简单的历史剧表演。,2023-07-04,IP属地：贵州
5分 超棒,匿名用户,"很有趣的活动，人不算太多，NPC们都很温柔，特别喜欢魔道祖师CP，阎王判官，狐狸书生兔子……NPC都好高好帅！！！
5点进，可以先逛逛，找找影视剧的影子",2023-08-15,IP属地：贵州
5分 超棒,俺家小宝贝月亮,感觉白天可能适合不喜欢人多的旅客去，白天人真心很少。设施现在有些破旧，有一些还在修葺。适合几个人一起去，拍照可能还有点意思，不然一个人去逛确实很无聊。,2023-07-16,IP属地：贵州
5分 超棒,匿名用户,天气很好 风景也很漂亮 跟家人一起来的 家人也很开心 晚上的表演也很精彩……虽然有点近视看不清楚 哈哈哈，晚上的人也很多……很热闹,2023-11-02,IP属地：贵州
