评分,用户,评论详情,日期,IP位置
3分 不错,沧海明月ZHU,影视城蛮大的，逛逛打打卡不错，里面有表演，还有骑马，还有放电影，，晚上亮灯门口那条街整个都灯笼真漂亮，租汉服穿上照相更是有感觉，，里面有卖吃的喝的，有点小贵十元起步，有个猪肉锅盔好吃，旁边的凉面也行就是别买银耳糖水放的太久吃了拉肚子了，，，这里拍过不少电影电视剧，来打打卡还行，门票还行，整个影视城各方面可以再提高一下。交通最好自驾，离市区远，有公交太久，打的方便，我们打的三十，不过晚上逛完出来就不好打车了，还有游客中心的储物柜五点之前必须取出，否则门会被锁了，只有等第二天了，要赶早。,2021-10-12,IP属地：未知
4分 满意,M11****642,有点老旧了，很多地方都荒废了，不过影视迷古装打卡还是挺好的，建议景区在热门打卡点进行标注，例如杏花别院，找了半天也不能确定是不是，拿出剧照比对半天，如果能有标注体验感会更好！,2023-06-21,IP属地：云南
5分 超棒,M51****9644,拍照的话可以，,2023-04-14,IP属地：广东
5分 超棒,羽咋郡宇文护,挺好玩的，我喜欢这种地方。值得去，下次放假带妈妈一起去,2021-02-19,IP属地：未知
5分 超棒,_CFT01****4496846,秦汉风格建筑超级棒……守卫的小哥哥穿着铠甲问我们是否需要拍照……免费合照……小哥哥很热情，还会让我们对暗号……哈哈哈……不错的体验。,2024-03-21,IP属地：贵州
5分 超棒,M21****900,非常值得去的一个景点，门票也便宜，老人小孩五元一人，成人好像是20，全部是仿秦汉时期的建筑风格，可以让小孩把历史代入现实，非常棒！,2025-05-06,IP属地：云南
5分 超棒,M40****1679,维护费差了点，其他的都还可以，实际拍摄地能够有点穿越的感觉，作为游客希望维护费好一点，玩起来才尽兴，可能也是旺季前来玩的原因,2023-06-19,IP属地：四川
5分 超棒,匿名用户,很开心的一次狂欢，果然是别人说再多不如自己来看一次，NPC好高好帅好美好温柔！只和谢怜花城，阎王陆判互动了，好可惜，希望下一次还能再去，手机像素太差了！！！！！！,2023-08-15,IP属地：贵州
5分 超棒,300****290,虽然当天天气烟雨濛濛，但是拍的片子还是挺好的，主要是人不多，可以随意拍，感受很不错，场景大气，穿上汉服拍就更出彩了，好评！,2023-02-03,IP属地：贵州
3分 不错,工匠,影视城没啥人气，和横店影视城之类不可同日而语，不过人少也好，可以随意拍拍拍，建筑还是很大气的，还原了秦汉宫殿的感觉，如果正好在都匀可以来看看。,2020-11-04,IP属地：未知
5分 超棒,Z~群,去都匀秦汉影视城的公共交通非常方便，四块的公交车就能到达秦汉影视城，里面的建筑风格都非常的震撼，有很大房屋建筑都非常的符合我的想象，有种身临其境的感觉，非常赞。在里面也有很多体验项目，汉服体验也是非常棒的,2025-04-15,IP属地：贵州
5分 超棒,匿名用户,"这地方，天气好的时候真的是非常好。
相对来说还是很大的，也比较漂亮吧。当然了，没有横店大的，但是造景也挺有气魄的。
还是再次表达，特别喜欢都匀的天气。
十一期间来这里游玩的，客流量都还行的，不是特别特别多的那种，也遇到剧组拍摄了，就是很好玩儿，走进去就有一种穿越感觉，特别奇妙。门口的宣传图片，大概是说有这么些剧在这取景拍摄过吧。",2024-03-12,IP属地：北京
5分 超棒,M19****401,来打卡陈情令拍摄地，非常开心非常有情怀～去的时候是八月底了，人很少，所以逛起来还是很有感觉的。每个小时都有点表演，但是表演质量只能说一般😂 可能因为人少好些地方也没开放，有点可惜。另外吃饭的地方太简陋了，桌子都是糊着油布的那种，比路边摊还差点，馄饨张也没开，这方面确实还是很需要改进的,2022-09-14,IP属地：上海
4分 满意,雨落佚蓝27,里面没多大，穿汉服拍照还可以，不然没啥好玩的，外地人60块门票，贵了，感觉不值，表演就几分钟，跳得非常之敷衍！虽然不是节假日也不至于这样吧。,2022-05-10,IP属地：未知
2分 一般,_WeCh****55317,"都匀才多大点？贵州有多大？初四哪天来了一场说走就走的旅行，在网上看到秦汉影视城，觉得还行，就去了，开了3个小时的车，去到地方瞬间后悔了，尼玛，本地人居然单独列一个售票窗口，难道贵州人不是本地人吗？询问售票员：有学生证的有优惠吗？没有,有士兵证有优惠吗？没有，直接无语。想到来都来了，就买了票进去，进去逛一圈就出来了。里面就是个坑。",2019-02-10,IP属地：未知
5分 超棒,匿名用户,"秦汉建筑适合换装拍照，喜欢拍照的小妹妹小姐姐可以选择日场，晚上夜场有青丘狐仙表演，还有互动，好玩
。",2024-08-10,IP属地：贵州
4分 满意,匿名用户,在都匀开发区，就算坐公交也很快就到了，淡季什么都没有，冷清的很，还有些地方在修缮。喜欢古装的可以去看看，比横店的秦王宫大点，性价比可以，偶尔还能看见拍戏的。,2024-03-08,IP属地：贵州
3分 不错,榕儿711,因为看了陈情令和庆余年，对这个地方产生了兴趣，约着朋友去看看，，整个景区不算很大，很多地方在维修，看到了秦皇宫，确实很雄伟，我们去的时候人不多，也没啥剧组在拍，看看还是可以的，但是也就只能看一下了,2023-05-15,IP属地：重庆
5分 超棒,匿名用户,"我很高兴看到在庆应义塾大学毕业后的请愿书的拍摄地点。自从我去公园开放时间以来,游客仍然很少,拍照很容易。",2025-04-22,IP属地：未知
5分 超棒,梦中芭蕉雨,以前看<陈情令>和<大秦赋>的时候，就知道了都匀秦汉影视城，这次终于有机会来看看了，高大巍峨的秦汉建筑群，古朴威严，瞬间想起电视剧里一些经典画面，也是第一次看到剧组，影视城里还有很多表演节目。,2023-08-12,IP属地：广西
5分 超棒,M25****9988,逛了一半下雨了，带着9个月侄子不方便只逛了三个小时，其实还可以再逛久一点，里面用推车也很方便，不近房子里面在主路上逛，近房子里不方便因为房子都是有门槛的需要抬，带婴儿的家长建议带轻便的推车。,2024-05-06,IP属地：广东
4分 满意,无糖冰阔落,还是很壮的，拍照也好看，可惜没有租到满意的服装。 唯一的问题是交通不便利，没有公共交通到达，往返只能靠打车，传说的22路不存在的。,2021-10-04,IP属地：未知
4分 满意,M33****5896,为陈情令拍摄地打卡而来，但是，服务跟不上，有点点失望，有些地方不让上去，比如藏书阁，有的地方乱七八糟，比如大合影的地方，遗憾,2023-07-26,IP属地：四川
5分 超棒,夏彦志,1:1还原秦汉的城市风貌，气势恢宏，很多影视作品拍摄地，值得一看,2022-07-24,IP属地：未知
5分 超棒,_WeCh****741412,去了2次，每次去的感受都不同，国庆继续前行。,2020-09-19,IP属地：未知
4分 满意,athenawangy,秦汉影视城，沉浸式体验一下从“旁观者”到“剧中人”，遇到有剧组拍摄的话可以看看，挺有趣的。喜欢庆余年或陈情令的逛起来可能更有意思些[得意],2025-04-24,IP属地：贵州
4分 满意,(^～^)静💖,园区里面还挺大的，就是有点破旧了，听说是陈情令的拍摄场地，所以到处可以看到男主角的剧照。有些地方拍出来还是蛮好看的，总体来说，性价比一般。,2024-08-16,IP属地：贵州
5分 超棒,M68****3789,民宿在景区里面，环境卫生都很好，前台小姐姐服务很周到，还到景区外面忙我们提行李，很热情，景区里面游玩攻略前台详细给建议。很赞，很值得点！,2024-09-11,IP属地：贵州
5分 超棒,匿名用户,还好看了，非常非常值得去逛一下，里面景色都很美，打卡很多影视剧同款场景，做妆造的也很多，npc都很敬业，可以看演出要合照，非常非常好,2025-04-12,IP属地：贵州
4分 满意,匿名用户,景区很大，适合穿汉服拍照，园区门口有个90多的套餐含穿汉服和表演的门票值得考虑一下，因为我们入园租汉服的价格是128元，来都来了……,2023-09-07,IP属地：广西
5分 超棒,myonlystar1982,虽然很多地方损坏了，又在维修。但顺路玩下还是不错的，门票不贵，停车不贵，学生免费，适合喜欢照相的人。晚上在看下活动热闹。还是推荐。,2024-08-25,IP属地：贵州
