评分,用户,评论详情,日期,IP位置
5分 超棒,人生就是一次旅行，快乐是最重要的！,"当你漫步桃林夹岸、良田美池，观赏秦晋时期农耕生活风貌，春季粉色花海与古村落相映成趣。放下一切，远离城市🏙️的喧嚣，让心❤️灵回归自然！呼吸天然氧吧！然后游览太古洞🕳️的""地下石林、世界奇观""，溶洞内千姿百态的沉积物形成壮观的岩溶地质奇观，无不惊叹大自然的神奇与鬼斧神工。徒步体验酉州古城全长1.3公里的土家吊脚楼建筑群，依山而建，展示800年州府历史与600多年土司文化，夜间与来自全国五湖四海的游客体验篝火晚会、摆手舞💃🕺等民俗活动。好不欢喜兴奋！！生活就该这样，越简单，也就越快乐！😎😁",2025-04-26,IP属地：重庆
4分 满意,好多昵称都被使用了,古时地名山南水北为阳，酉阳10余公里长的县城东西两侧都是山，酉阳河也从北至南贯穿整个县城，不知因何命名为阳。国家级卫生县城的称号名不副实，只因城中河水污浊不堪。发现好几座桥上车辆通行规则是靠左，很是诧异，后来想想，是为了便于汇合进入沿河两侧三车道的单行道。酉阳还是有一些民族特色的，如街上卖的火纸还保留着钱錾凿过的样子，估计也是机械化加工吧！酉阳桃花源其实都是一个天坑，不大，倒还算精致，太古洞长3.5公里，单行。大致看了一下，两个小时搞定。,2025-05-07,IP属地：四川
5分 超棒,半盏晚风,"桃花源景区位于有""重庆凉都""之称的避暑胜地酉阳县城近郊大山之中，是国家5A级旅游景区，被认为是陶渊明笔下《桃花源记》原型地，由世外桃源、太古洞、酉州古城、桃花源国家森林公园、二酉山等组成。

桃花源景区游览分为A线和B线，A线是从山上的北门进入，穿过太古洞进入天坑(桃花源)，穿过大酉洞从南门出景区；B线是从南门经大酉洞进出，在天坑里转一圈，不进太古洞。

整个桃花源景区地貌大概就是穿过大酉洞进入一个天坑，比较符合陶渊明笔下的《桃花源记》的描述，所以整个游览线路，按照《桃花源记》进行了人景布置打造。

桃花源的美池大概是天坑中心，景区标志性宣传照片多见此处，不过桃花盛开期短，我们去时美池亭子边的桃花🌸已开过，全是一片翠绿，没有桃花的点缀，少了亮点。

🔸桃花灿烂，阳光正好，漫步园中，悠闲舒适。在一间“教室”，有游客来，“老师”就会“讲课”，言谈举止，很有学识修养。还有各种农活体验，有少量跟场景搭配的商品出售，没有太多的商业化。

🔸B线，完全没有难度，很适合老年人或腿脚不太方便的，还有就是喜欢拍照的，有有足够的时间在天坑(桃花源)里转转拍拍。


tips:
💰门票：100元，两大门间有景交车10元。
🕒游览耗时：2-3小时
🌸最佳季节：3-4月(桃花源当然是桃花盛开的季节最好)
🏚酉阳县城住宿：推荐桃花源旁边的酉州古城内，自驾车可以停在酉州古城下面的酉州体育馆，几个地方都很近很方便。
🏡酉阳其他景点：叠石花谷、龚滩古镇、龙潭古镇",2020-05-04,IP属地：未知
5分 超棒,山茶叶蛋糕,读过陶渊明的《桃花源记》，总以为这个桃花源应该是远离尘世的，在一个很远很远的地方，然而酉阳的桃花源却就在县城边边上，让人有点意想不到。然而，通过山洞与外界相通，确实又有点《桃花源记》里记述的那么点情形，可以去体验体验。,2019-04-09,IP属地：未知
5分 超棒,132****5758,重庆酉阳桃花源，是陶渊明笔下《桃花源记》原型地，基本还原了一个“问今是何世，乃不知有汉，无论魏晋”的遗世独立的秦人村落，让人恍若穿越千年时光，置身2000多年前的秦人村落，不由令人产生“问今是何世”的幻觉，亲身体验远古风情。若想亲临世外桃源的朋友，现在景区门票打八折哟……,2020-09-24,IP属地：未知
4分 满意,鱼老蓓,"世界上有两个桃花源，一个在您心中
那另外一个就是在咱们重庆的酉阳
酉阳桃花源，一年四季仙气缭绕，远离世外
暖春3-4月，桃源村内桃花盛开的绝世美景
更是你绝对不能错过的春游踏青绝佳胜地

这个季节的桃花源洒满春色，会让你有一种时光
逆流之感，到过的场景彷佛回到秦晋，这时候
你可以在换装处，租赁一身“秦装”，彻底让
自己融入这远离喧嚣的桃源世外，做一次古人

桃花源在满村桃花装扮的盛景下，应该是一年
中最美的季节，时间短暂却四处充满无限春光
小溪旁、丛林中、茅草屋边...到处都是粉色桃花
世间所有的春意都已经在桃花源集合

桃花作背景，你还可以在桃源村内到访古乐演奏
的秦乐坊、小酌桃汁清露的归园田居
慢品叶曲青艾的缘溪榭、体验竹编的秦趣苑

景区内展现着2000年前的“秦人、秦风、
秦貌、秦趣”，所谓“男耕女织，天人合一”
仿佛一梦回秦，随手一拍就是云雾缭绕的仙境

特别喜欢桃花源内毫不做作的自然风景
游荡在水中的鸭子、林中的鸟叫、田地茅草屋
静静游览的同时，还可体验织麻布，同时还能
品尝到美味的酥食、特色的油茶汤、汽汽糕
还有油粑粑等等一些土家特色美食....

美好的事物都很短暂，桃花源的桃花观赏期只到
4月中下旬，还有半个月的时间，抓住春尾巴
带着家人朋友、另一半去寻找桃林中的宁静

游玩指南

交通：重庆—酉阳县，自驾单边380公里（车程大概5小时左右），过路费195元（6月30日前高速路免费）
门票：酉阳桃花源：100元/人；叠石花谷：99元/人；龚滩古镇：16元/人；乌江画廊游船票：158元/人；

春季游玩线路推荐：
第一天：酉阳桃花源赏桃花-住酉州古城
第二天：叠石花谷踏春
第三天：龚滩古镇游完乌江画廊后返程

【门票特惠】

1、即日起至6月30日止，酉阳旅游各景区（酉阳桃花源、龚滩古镇·乌江画廊、叠石花谷）针对散客实行“买一送一”。

2、全国医护工作者实行全年不限次免费入园，时间截至2020年12月31日，医护工作者凭有效证件即可免费入园。",2020-03-27,IP属地：未知
5分 超棒,gz当地向导伊妹儿,酉阳桃花源花已开，景色很美很漂亮，原生态自然风景，爬爬山，看看桃花，惬意舒适，拍照的好地方，春暖花开，踏青赏春的好季节，当然不能错过。,2021-03-04,IP属地：未知
5分 超棒,时刻悠然2,酉阳桃花源，从重庆坐车要好久才能到，路程就耽误了一天，加堵车、休息等时间，不过到了以后，感觉还是值得一去的，桃花源里的风景，就是陶渊明的《桃花源记》里描述的模样，淳朴的田园景致，总算不像其他景点一样人头攒动、摩肩接踵了，桃花源里大概分为两部分，一部分是外面的山水、院落，另一部分是太古洞，各式各样的钟乳石赔上五彩的灯光，真是很漂亮，还有许多钟乳石的样式，真的很“真”，可以尽情发挥想象力，不过事先要选好，因为是“单行线”。,2018-11-09,IP属地：未知
5分 超棒,老老倪,酉阳桃花源位于重庆市酉阳县桃花源街道源泉新路7号，面积约50平方公里，保存有国家一二级动植物，是陶渊明笔下《桃花源记》原型地，2012年入选为国家5A级景区。景区由世外桃源、太古洞、酉州古城、桃花源国家森林公园、金银山、二酉山等组成。,2023-08-15,IP属地：吉林
5分 超棒,小熊345,非常棒，门票100特别值，10元景区车带你到全程入口，进去就是太古洞，特别震撼，腿脚好的一定要玩儿全程。桃花源景区也是很漂亮，人工喷雾，古香古色的房屋建筑，田园树木，本次行程最棒的一个景点,2019-03-13,IP属地：未知
5分 超棒,老吴华哥,酉阳桃花源景区集岩溶地质奇观，秦晋农耕文化，土家民俗文化，自然生态文化等于一体。世界上有两个桃花源，一个在您心中，一个在重庆酉阳。一千六百多年肴，晋代大诗人陶渊明写下了“桃花源记”留下了一个令世人追逐的“世外桃源”。,2019-09-28,IP属地：未知
5分 超棒,庐州左耳东,传说陶渊明笔下的桃花源指的就是这里，去的时候因为景区做活动，门票买一送一，还是非常值的，穿过太古洞（太古洞是个大的溶洞，景色不错的），就来到了世外桃源，换上古装后在景区内游玩，确实有种陶渊明笔下桃花源记中的感觉,2018-08-28,IP属地：未知
5分 超棒,M16****462,酉阳桃花源景区总体来说是不错的，其中桃花源景区的景色足够吸引人，可拍照留影的美景不少，有一定的趣味性，指示标牌清晰。不过太古洞内的上下台阶够多，路途够长，上年纪的和腿脚不便者需慎重选择。此外，从游客中心前往酉州古城的中转车（票价10元）是一小时一发车，而小火车（20元）半小时一发车，还没有步行前往路线，在时间和费用等方面，多少给人不人性化的感觉。建议不打算游太古洞者，可直接到酉州古城，进而游览整个桃花源景区（游客中心出发方案，要放弃部分景点，否则得走回头路）。从桃花源景区返回时，还可以坐2元的观光车回到酉州古城停车场。,2023-10-31,IP属地：重庆
4分 满意,舒洲,桃花源这个卖点很好，但是深度做得不够，体验感和文化内涵做得不够，空有形式没有灵魂。多学学迪士尼，从景观、设施、人物、情节等所有细节都能让你完全沉浸在它打造的童话世界里，如果桃花源也能带给我们这样一种体验就好了,2022-04-18,IP属地：未知
5分 超棒,M49****3198,世上有两个桃花源，一个在重庆酉阳一个在你心中，是陶渊明《桃花源记》笔下的真实习照，游完美丽的桃花源后面是太古洞，太古洞全长三公里，整个太古洞虽徒步2个多小时，美丽的大自然天然溶洞是无法用相机与语言描绘的，只有身临其境才能体会大自然的鬼虎神工,2021-10-10,IP属地：未知
5分 超棒,莺语花儿,"酉阳地处重庆市东南部，武陵山腹地，是重庆幅员面积最大、少数民族人口最多、森林覆盖率最高、平均海拔最高的区县，是重庆唯一不享受高温补贴的区县，是“火炉”重庆名副其实的“凉都”。
个人认为桃花源就是世外桃源，风景秀丽，山清水秀才为桃花源，是一个没有人间烦恼、安逸宁静的好地方。",2021-09-14,IP属地：未知
4分 满意,社会颜色,"“世界上有两个桃花源，一个在您心中，一个在重庆酉阳。”一千六百多年前，晋代大诗人陶渊明写下了《桃花源记》，留下了一个令世人追逐的“世外桃源”。

酉阳桃花源景区距重庆市主城300公里，景区总面积50平方公里，由世外桃源、太古洞、酉州古城、桃花源国家森林公园、桃花源广场、桃花源风情小镇、二酉山世外桃源文化主题公园和梦幻桃源实景剧等八大部分组成，集岩溶地质奇观、秦晋农耕文化、土家民俗文化、自然生态文化、休闲养生文化、运动康体文化于一体。是现代人远离尘世喧嚣，步入秦晋田园、探寻科学奥秘、回归绿色天堂的好去处。",2020-09-12,IP属地：未知
5分 超棒,天涯游玩人,酉阳桃花源景区距重庆市主城300公里，景区总面积50平方公里，由世外桃源、太古洞、酉州古城、桃花源国家森林公园、桃花源广场、桃花源风情小镇、二酉山世外桃源文化主题公园和梦幻桃源实景剧等八大部分组成，集岩溶地质奇观、秦晋农耕文化、土家民俗文化、自然生态文化、休闲养生文化、运动康体文化于一体。是现代人远离尘世喧嚣，步入秦晋田园、探寻科学奥秘、回归绿色天堂的好去处。,2019-09-09,IP属地：未知
5分 超棒,山茶叶蛋糕,学过《桃花源记》的都会想到桃花源肯定是很神秘隐藏于深山的，但酉阳县的桃花源风景区却是在县城边上。严格说就是在县城，只是通过一个溶洞，形成了与世隔绝的感觉，景区打造还是很好，景点都和《桃花源记》相呼应的。,2019-06-17,IP属地：未知
5分 超棒,感谢余生有你,桃花源还是非常值得去的。虽然我是6月份去的没有赶上桃花盛开的时候；但是世外桃源里面的景色还是十分优美的，还有表演看只是为了赶去乌江画廊没看到。 太古洞里面也是非常漂亮……,2018-06-08,IP属地：未知
4分 满意,匿名用户,"《酉阳桃花源景点评价》

酉阳桃花源，作为一处享有5A景区殊荣的旅游胜地，一直承载着众多游客的期待。然而，在亲身游览之后，个人感觉其整体表现中规中矩，在性价比方面尚有可提升的空间。

从景区特色来看，它似乎缺乏那种能让人眼前一亮、过目难忘的独特魅力。相较于其他一些知名景区，其个性不够鲜明，未能充分展现出足以让游客深感震撼且难以忘怀的特色亮点。这或许与景区自身的资源禀赋以及开发打造方向有关，使得它在众多景区中辨识度略显不足。

就景区内的溶洞景观而言，虽然也有一定的观赏价值，但与织金洞等以溶洞景观著称的名胜相比，无论是洞内景观的丰富程度、奇特造型还是整体规模，都稍显逊色。织金洞那如梦如幻、鬼斧神工般的钟乳石奇观，仿佛是大自然精心雕琢的艺术殿堂，给人带来强烈的视觉冲击和心灵震撼；而酉阳桃花源的溶洞，虽也有自身的独特之处，但在对比之下，就显得不那么突出了。

不过，对于尚未来过酉阳桃花源的朋友来说，这里还是值得一游的。每个人的旅游体验都是独特的，也许你会在这里发现别样的美，感受到那份宁静与闲适，领略到不同于其他景区的风情。毕竟，旅游的意义不仅在于欣赏绝美的景色，更在于丰富人生阅历，体验不同的文化和生活方式。",2025-04-02,IP属地：江苏
5分 超棒,福霖,去重庆，桃花源是一定要去看一看的，自驾的话，离重庆约四小时车程，也有城际高铁去酉阳，但是酉阳火车站离景点比较远，约40分钟车程。景点周边也有古镇等其他景点，吃住都方便。景区美景就更不必说了，看图片吧。,2022-01-23,IP属地：未知
5分 超棒,彩色栀子,"小学课本里，陶渊明的《桃花源记》，一直在脑海里浮现：晋太元中，武陵人捕鱼为业，缘溪行，忘路之远近，忽逢桃花林，夹岸数百步，中无杂树，芳草鲜美，落英缤纷，渔人甚异之，复前行，欲穷其林。
林尽水源，便得一山，山有小口，仿佛若有光。便舍船，从口入。初极狭，才通人，复行数十步，豁然开朗，土地平旷屋舍俨然，有良田、美池、桑竹之属，阡陌交通，鸡犬相闻，其中往来种作，男女衣着，悉如外人，黄发垂髫……我是边背课文，边游览这绝美的风景，仿佛整个人已经置身于陶渊明的感觉。",2021-12-26,IP属地：未知
4分 满意,seekciel,"重庆之行的第一站酉阳，桃花源景区分为两部分：全程票价128含太古洞+世外桃源，半程票价96仅世外桃源核心景区。
太古洞全程步行大概1h左右，千奇百态的钟乳石配合灯光效果很是漂亮。穿过太古洞即可到达世外桃源景区，景区入口处提供换装服务（20元/人），这个季节没有桃花，算是淡季，游客寥寥很是清净，一间间仿古的茅舍，很有土地平旷，屋舍俨然之感。景区不大，1.5h差不多就能游览完毕。",2018-09-25,IP属地：未知
5分 超棒,1397137,如果自驾把车停在游客中心就必须花20块钱坐小火车到北门，如果把车停在北门又要在古城一条街上走十分钟到检票口，所以停在东门检票口最好。,2024-03-25,IP属地：重庆
5分 超棒,韩斯达,两个景区都很美，联票很合适。第一天去的桃花源，时间原因古洞没去，下午住在龚滩古镇，古镇也很棒。第二天从古镇坐船游的乌江画廊。美美美,2023-09-11,IP属地：河北
5分 超棒,风之痕123123,"酉阳桃花源，现在是大名鼎鼎。桃花源景区，位于重庆市酉阳土家族苗族自治县境内桃花源路232号，东邻湖南省龙山县，南与秀山县及贵州省松桃、印江县接壤，西与贵州省沿河县隔江（乌江）相望，西北与彭水县，正北与黔江区及湖北省咸丰、来凤县相连。

        酉阳桃花源景区总面积50平方千米，由古桃源、太古洞、酉州古城、桃花源森林公园、桃花源广场、桃花源风情小镇、二酉山世外桃源文化主题公园、桃源大舞台等八部分组成。集岩溶地质奇观、秦晋农耕文化、土家民俗文化、自然生态文化于一体，浓缩了中国武陵山区最美的原生态自然田园风光，传承着土家族、苗族悠久的人文历史与灿烂的民族文化。
【景色】
【趣味】
【性价比】",2022-08-24,IP属地：重庆
5分 超棒,M39****0843,"酉阳 桃花源位于 重庆 市 酉阳 县，属于国家5A级风景区，乘坐汽车可在主城区平四公里长途客运站购票上车，全天共有九班车发往 酉阳 ，汽车发车运营时间9：50――18：00，另外可在 重庆 西站， 大学城 西部客运站上车，票价约120元左右。
    桃花源在每年的三月份正是桃花烂漫的时节，将满山遍野都染成绯红，而且那里属于少数民族聚集的地方，民族特色浓烈，生活节奏比较慢，没有大都市的喧嚣纷扰，就像陶渊明笔下所写――黄发垂髫，并怡然自得。
     桃花源门票120元左右，那里的特色住宿又有很多，如果想要住的豪华，我推荐 酉阳 喜悦秘境酒店，如果想节约一点我推荐 重庆 酉阳 桃花源大酒店，如果想要感受民俗住宿可以选择 酉阳 土家族苗族自治县民宿。
     酉阳 以土家族为主，最具特色的美食有麻旺鸭，小河油菜汤，土家油菜汤，蒸羊蹄，野生鱼类，油裹子，粽粑，斑鸠豆腐，这些都很具有地方特色，当然还有很多美食，到时候去了可以去品味一番。
    吃住行都解决了，下面就来谈一谈有3什么好玩的， 酉阳 除了桃花源还有其他美丽的景点， 比如 芙蓉洞景区， 赤水 风景区， 武陵源 风景名胜区，长江 三峡 ， 张家界 ，凤凰古城， 梵净山 等景点。
     酉阳 桃花源还有各色各样的纪念品，喜欢的可以买回家做个纪念，还有许多好玩的娱乐设施， 比如 划船观光旅游等等，相信你们也一定想要去游览一番吧！",2020-04-08,IP属地：未知
4分 满意,鱼老蓓,"酉阳桃花源的花也在陆陆续续开放了
虽然这些花叫不出名字 但是春天能看到花心情好好哟
各种颜色让酉阳桃花源真的是世外桃源
期待开放的那一天

世界上有两个桃花源，一个在你心中，一个在重庆酉阳 。”我觉得这句话真是写得太好了，看到景区烟雾缭绕的，觉得也真很值。",2020-03-07,IP属地：未知
4分 满意,非典型师奶,"酉阳桃花源景区里面分了好几部分，进入景区后，各种感叹大自然的鬼斧神工...伏羲洞内神秘瑰丽的石钟乳更是巧夺天工，由天生灰质溶液凝聚而成的洞穴景观琳琅满目、美不胜收、无所不奇、无所不有，仿佛一座神奇的“魔宫”。酉阳桃花源位于重庆酉阳土家族苗族自治县内，可搭火车到酉阳站或者在重庆自驾前往。沿途还可以在附近的龚滩古镇及酉州古镇走走，也是很不错的。估计是因为酉阳这个地方不太出名，所以往往被人忽略了，我们国庆假期第一天到达，景区里的游人并不多，可以让我们休闲地带着娃娃们好好欣赏这里的美景，真心不错哈～
✨酉阳是个小山城，公共交通设施可能不算发达，所以比较建议自驾前往，附近其实可以玩的小景点也挺多的，可以顺道一起玩。
✨住宿的话可以选择就住在酉州古镇里，虽然古镇不大，但还是比较古色古香的，而且古镇就在桃花源旁，游玩也方便哈～",2020-01-15,IP属地：未知
4分 满意,320****829,酉阳桃花源名气挺大，他的广告说世上有两个桃花源，一个在酉阳，一个在你心里。其实没广告那么漂亮，里边就两个景区，一个世外桃源，一个太古洞，太古洞风景不错，有一个多小时才能游完，而世外桃源是人造景观，没有多大，快的话，几十分钟慢慢的游也就一个多小时，除了景区是酉州古镇，其实就只有一条街，现代人造的古城，国庆期间也没多少人玩，很清淡，全程游的游客想回到起点得乘坐桃花源旅游公司的中转车，要收十元钱一个，门票是不包含车票的，其实这里过去就六点几公里，十元钱一个也太坑人了，如果是一家人的话，自己打的过去，也就十多块钱,2018-10-03,IP属地：未知
5分 超棒,小马世界,太古洞全程3公里，里面面积很大，空间很高，打着各种灯光，到处是奇形怪状的钟乳石，让人目不暇接，仿佛穿越时空的隧道到了一个华丽的地下宫殿。洞子的尽头就是桃花源景区。里面花草树木，亭台楼阁，就是一个世外桃源！,2018-06-22,IP属地：未知
5分 超棒,人鱼小公主🧜‍♀️👸,真心不错👍果然看到了陶渊明先生笔下的世外桃源🥰春天桃花开了应该是最美的！这个时候去，花儿没什么，但是体验一下田园风光真心不错👌推磨，碾碎，打豆腐……惬意,2021-10-05,IP属地：未知
5分 超棒,M31****9710,很美的地方，我特别喜欢里面的溶洞，溶洞特别大，灯光也挺美的。感叹大自然的鬼斧神工。不过去的朋友建议带上外套。我们八月份过去的。但是洞里面还是很冷的。不过我的照片没有那么唯美，借用别人几张照片。,2019-04-19,IP属地：未知
5分 超棒,布晓呆,桃花源是陶渊明小说中描写的理想王国。中国有多个名为桃花源的景区，酉阳桃花源是最接近理想王国的地方。这里山清水秀，民风淳朴，空气清新，让人流连忘返。,2021-11-25,IP属地：未知
5分 超棒,clueboy,微缩秦晋田园风景，锦鲤戏水，更可惜7月底过来，四川游客免票！不小的惊喜！可惜疫情影响，太古洞没有开放！,2020-07-30,IP属地：未知
4分 满意,蓝山和摩卡,"景区管理需要给赞，无论是接受电话咨询，还是行李寄存等等，可以给满分。
但是，我们游览的主题并不是这个，在酉州古城住了两晚，今天逛了桃花源主景区。
只能说，作为消闲度假还是过得去，作为旅途经停小驻也没问题，单独跑一趟，意义不大，宣传毕竟还是宣传，人工雕琢为主的景区，缺乏灵性。",2021-06-03,IP属地：未知
5分 超棒,_WeCh****319358,5A级景区，我们是下午进入景区，可能是桃花季节已过，人很少，太谷洞全程走下来，看到的游客不超过10个人，这对于每次出游看到景区内都是人山人海的我们来说，简直是大大的惊喜，商业化不严重，简直不要太好，桃花源里风景优美，来到这里，心都静了，期待下次桃花盛开的时候再来一次,2019-04-20,IP属地：未知
5分 超棒,匿名用户,"到酉阳桃花源景区已经是大中午了，太阳很晒，但是已进入山洞特别凉爽，太喜欢了，桃花源真的如陶渊明写的世外桃源一样，一进入，凉风习习，“林尽水源，便得一山，山有小口，仿佛若有光。”和文中写的一模一样。
再往里走，“复行数十步，豁然开朗，土地平旷，屋舍俨然，有良田、美池、桑竹之属。” 虽已没有了鸡犬相闻和种作，但也能感受到这怡然自得悠哉悠哉。",2024-07-28,IP属地：湖北
5分 超棒,布晓呆,酉阳桃花源景区，位于重庆市酉阳土家族苗族自治县境内桃花源路，酉阳桃花源景区总面积50平方千米，由古桃源、太古洞、酉州古城、桃花源森林公园、桃花源广场、桃花源风情小镇、二酉山世外桃源文化主题公园、桃源大舞台等八部分组成。,2022-10-22,IP属地：重庆
4分 满意,李肖山,林尽水源，便得一山，山有小口，仿佛若有光。便舍船，从口入。初极狭，才通人。复行数十步，豁然开朗。土地平旷，屋舍俨然，有良田、美池、桑竹之属。,2022-07-10,IP属地：未知
5分 超棒,季先森 7,酉阳桃花源，三月踏青的好去处，桃花悉数开放，美轮美奂。虽然有很多人造因素，但并不突兀，是居家旅行拍照打卡的好去处。源里的鸭子等你投喂，也特别可爱，太古洞确实是景区的一大亮点，三亿年形成的溶洞，2.5公里的长度，其中满是造型独特的怪石地形，走了一个多小时才走完，虽然有点累但真的过瘾！,2021-03-15,IP属地：未知
