评分,用户,评论详情,日期,IP位置
5分 超棒,Aaron,总体超赞，性价比高，人也不多，景色不错，特别是里面的一些村落的设计很有原生态的。这种感觉他要进去一个山洞之后就是有几个小小的村落，工作人员也很不错，唯一比较遗憾的是山洞里面没有开，还有顶上的一个观光，火车也还没有开，如果开了的话，景色应该会更好，很奇怪的，就是在这一个古城里面的人非常少很多门店都关了比较冷清，有点吓人，桃花源里面的性价比还是非常高的。,2020-12-18,IP属地：未知
5分 超棒,_WeCh****56614,提前一天订，携程上只要80，当天买100。看了别人的评价说太古洞可以不去看，走完全程有点儿累，开始我们还犹豫要底去不去游洞。现在已经没有半程票了，南门即半程游客接待中心是半程的入口，全程的出口。可以留一辆车在出口，然后大家游玩出来后，司机去进口即北门把车开过来接大家，自驾游还是方便。个人真心觉得太古洞里大，奇，比人造的桃花源景区更有看头。这个季节没有桃花，有桃花花l0O专门来看太贵，作为重庆人爬坡上坎这点儿路程不算啥！,2019-08-05,IP属地：未知
3分 不错,_WeCh****279937,今天下雨，游览了酉阳桃花源，也就是陶渊明笔下桃花源原型地！一边重温《桃花源记》，一边欣赏桃花源实地，感觉和以前单纯阅读《桃花源记》完全不同，更有感觉了！只是季节不对，没有桃花。门票100元也觉贵了点，50还行！,2019-05-19,IP属地：未知
5分 超棒,一个人爱的旅行a梦,很美，人间仙境，景区沿途有几个仿古村庄还有各种特色美食卖，价廉物美，可以在里面玩一整天不需要带吃的，我们游览时天气正热，里面凉风习习十分凉爽玩得不想走。,2021-09-11,IP属地：未知
5分 超棒,gz当地向导伊妹儿,酉阳桃花源，晋太园中，武陵人捕鱼为业。缘溪行，忘路之远近……山有小口，仿佛若有光……桃花源，常德乎？酉阳乎？唯心中谁都欲罢不能……,2019-08-13,IP属地：未知
4分 满意,川南一纤夫,少数民族地区的5A级景区，管理和设施都待提高，太古洞内没有路程距离标识，仅仅在离出洞500米处有个小牌，厕所内乱纸条到处都是，太古洞里厕所好臭，这个5A看来是照顾的！,2023-04-02,IP属地：重庆
5分 超棒,小林PL,世界上有两个桃花源，一个在你心中，一个在重庆酉阳，陶渊明笔下的桃花源，值得你来一趟。,2018-06-21,IP属地：未知
5分 超棒,able,"世外桃源景区分为地上田园风光和地下石林溶洞景观，身临其境陶渊明《桃花源记》里写到的“夹岸数百步，中无杂树，芳草鲜美，落英缤纷”的遗世风光。
忽逢桃花林→缘溪行→便得一山→初极狭→豁然开朗→潜村（10点看表演）→靖节村→隐匿村→状元堂→陶公祠→需要折返至状元堂→太古洞（溶洞奇观）。
太古洞是单行道，出来坐转运车过林梢飞车回酉州古城北门。",2025-04-09,IP属地：四川
5分 超棒,able,"世外桃源景区分为地上田园风光和地下石林溶洞景观，身临其境陶渊明《桃花源记》里写到的“夹岸数百步，中无杂树，芳草鲜美，落英缤纷”的遗世风光。
早9点从南门检票口进入桃花源景区，忽逢桃花林→缘溪行→便得一山→初极狭→豁然开朗→潜村（10点看表演）→靖节村→隐匿村→状元堂→陶公祠→需要折返至状元堂→太古洞（溶洞奇观）。
“豁然开朗”打卡后，可进入石室藏书，观焚书坑儒时期古人藏书洞。
 在田园区的茶亭喝一碗重庆老鹰茶，赏阡陌田野，落英缤纷，感受“避世”意境。",2025-04-07,IP属地：四川
5分 超棒,爱母喵喵,"酉阳桃花源
导航到桃花源广场，车好多，找地方

不要沿坡向上，是酉洲门楼

先路过大酉洞，确实很大，可以爬上去，一出来是个山水人家，有桃花，正在盛开期间

有个DIY的染布坊

之后再往前走，各种花和树，还有小桥河流

一直走到太古洞，洞太长了，不去了，原路返回，未来去织金洞弥补，洞内风光",2025-03-31,IP属地：贵州
5分 超棒,小西闹钟,"主要包含农家风情体验与太古洞两个风景。

农家风情体验主要以陶渊明的诗句建立了几个小的村庄，一个一个小村庄游玩。

重头戏其实是太古洞，这个洞太大了，洞中自成世界，整个游玩过程感觉就是在一个巨大的洞里面爬山。",2025-02-12,IP属地：重庆
5分 超棒,匿名用户,去了重庆周边的酉阳桃花源景区，五一假期桃花已经没有了，景区的环境不错，还有节目表演，太古洞比较大，走起来很累，出太古洞景区后，需要乘景区巴士回到景区门口，车票10元/位。或者乘林稍飞车20元/位，好评。,2024-05-29,IP属地：山东
5分 超棒,happiness旅行路上,整体景色还是不错，景点路标还算比较清晰，太古洞里面有些自然景观还是值得观赏。不过可能景点设置和工作人员安排等不一样，我只是觉得像有的溶洞景点会配一个带十几二十人的讲解，感觉这样浏览更有实用性，也可以通过讲解再宣传一下酉阳。,2023-06-17,IP属地：重庆
4分 满意,秒懂风景,酉阳桃花源属于国家5A级旅游景点，它距重庆4小时车程。酉阳桃花源占地面积50平方公里，主要是由世外桃源、太古洞、酉州古城、桃花源森林公园、桃花源广场、桃花源风情小镇、二酉山世外桃源文化主题公园、桃源大舞台八部分组成。,2022-05-13,IP属地：未知
5分 超棒,M42****536,世界上有两个桃花源，一个在您心中，一个在重庆酉阳！五一游完乌江画廊随路去看看，虽然桃花早已开过，但里面的风景还是不错，有一种世外桃源的感觉，准备来年桃花盛开的时候约上三五好友去拍照,2020-05-03,IP属地：未知
5分 超棒,柏拉图简谱,这次重庆之行 最惊艳的一段行程无疑是在酉阳桃花源 强烈推荐一点要走全程线路 因为最美的景色绝对是在太谷洞 洞内各种钟乳石奇观 配合着彩色的灯光 真是美不胜收 桃花源的风景也不错 适合慢慢游览 非常推荐这个景点 主要游客还不算多 不用人挤人,2019-08-17,IP属地：未知
5分 超棒,M25****4082,太古洞和桃花源都很美，太古洞里面超级凉爽，对于灯光的设计和运用真的很成熟！桃花源景色很美，植被超级多，有良田美池桑竹之属，很符合心里对桃花源的期望！里面的小吃也很美味，定价也比其他很多景区要便宜得多。总之，真的超级棒，完全值回票价，不愧是5A级景区。基础设施也很完善。,2019-08-09,IP属地：未知
5分 超棒,M27****9681,我是来到这边避暑的，由于时间不多，所以买的半程票，里面亭台楼阁，长廊竹桥都很漂亮。还有石磨，秋千，碾子等体验项目，茅草屋等各种比比皆是，里面还有很多店铺买各种小玩意，绣坊的刺绣可以说是很美了，还有扇子，桃花蜜，砸碗酒等也都蛮不错。,2018-07-14,IP属地：未知
5分 超棒,sky～li,"就像景区宣传说的一样，每个人心中都有一个桃花源。只要读过书的人都知道陶渊明的桃花源记，有机会到实地看看，真的很有意义。最好是3,4月份来，满园的桃花会更美丽。",2022-02-08,IP属地：未知
5分 超棒,乐堡窝窝,非常好👍大自然的鬼斧神工天然美好，加之人文设计的锦上添花，浑然一体，值得反复体验！景区服务工作人员态度非常好，耐心爱心服务，哪怕是一位保安人员都体现了极好的职业素养，展现了我们大重庆的人文风采！,2024-02-13,IP属地：重庆
4分 满意,凌之之,所谓的桃花源，由2个景点组成，太古洞是属于地下溶洞，全长3.5公里，加了灯光效果，感觉还不错，就是楼梯上上下下有点累。。桃花源就是一个模拟深山村落的景象。，,2019-10-05,IP属地：未知
5分 超棒,扎克依维提,"好清新，景色益人，洞奇景美，美食品尝。
【景色】美美美美",2021-04-27,IP属地：未知
5分 超棒,天边的海999,像是一场置入式穿越情景剧，在演绎中已分不清现实和时间，享受着最淳朴的田园生活。仿佛犹如仙境一般，回来的时候都不爱离开这里了，这里的空气太好了，景色太美了。,2019-07-27,IP属地：未知
5分 超棒,gehrehrjhjrjj,途经不经意发现的景点，美不胜收。真的如陶渊明笔下的世外桃源一般，初入溶洞被大自然的鬼斧神工震撼，刚出洞口眼前豁然开朗，土地平旷，屋舍俨然，有良田美池桑竹之属。值得一游！,2019-07-16,IP属地：未知
5分 超棒,清清乐乐果果,一千多年前，陶渊明写了著名的桃花源记，不知是否是写这里。鬼斧神工的重庆酉阳桃花源太古洞，就在桃花源这里，最高空间79米，最宽处50米，空穴空间大。,2018-08-03,IP属地：未知
4分 满意,滇国剑客,这是一个风光秀美，远离闹市之地，生活在都市的人们可以来领略大自然的清新气息与纯真丰彩。,2016-06-19,IP属地：未知
5分 超棒,233****659,从重庆主城过去的，到酉阳后以为只要48h才能进，工作人员告知要离开主城后三天两检才能进入，还好我们要在酉阳多耍几天😂我们全程步行，从南门进，太古洞出，步行回到北门，最后回到桃花源广场,2022-10-20,IP属地：重庆
5分 超棒,山茶叶蛋糕,酉阳桃花源景区位于重庆市酉阳土家族苗族自治县，类似陶渊明笔下《桃花源记》原型地，酉州古城是酉阳桃花源景区的组成部分。古镇上的美食很多，但最爱的还是古镇红烧肉，肥瘦合适，香味回味无穷。,2018-08-24,IP属地：未知
5分 超棒,_WeCh****857557,景区很漂亮，只是我们没来对时间，桃花还没开，其它都还是很漂亮的。里面的泉水很清澈，有很多小瀑布，溶洞很大，布置也很漂亮，我们是原路返回的，又把景区美景欣赏了一遍,2025-03-06,IP属地：重庆
5分 超棒,匿名用户,由古桃源、太古洞、酉州古城、桃花源森林公园、桃花源广场、桃花源风情小镇、二酉山世外桃源文化主题公园、桃源大舞台等八部分组成。集岩溶地质奇观、秦晋农耕文化、土家民俗文化、自然生态文化于一体，浓缩了中国武陵山区最美的原生态自然田园风光，传承着土家族、苗族悠久的人文历史与灿烂的民族文化。,2025-02-06,IP属地：四川
5分 超棒,匿名用户,酉阳桃花源，是与陶渊明的《桃花源记》中记载考证有据的一个景点。酉阳人自信的宣称：桃花源一个在每个人心中，一个在酉阳这个地方。确实，酉阳人做了许多有益的工作，景点是有趣的，值得一游。,2023-09-10,IP属地：重庆
4分 满意,萌萌潼小潼,整个桃花源环境比较符合陶渊明的桃花源记，路上的标语也都引用了桃花源记里面的内容，有一点诗酒田园的感觉 路程比较长，带小朋友步行的话太古洞需要仔细考虑，在景区门口租了秦朝服装给小朋友拍照，小朋友全程很开心,2023-05-17,IP属地：贵州
4分 满意,社会颜色,酉阳桃花源景区位于重庆酉阳自治县城区，总面积50平方公里，景区由古桃源、伏羲洞、酉州古城、桃花源森林公园、桃花源广场、桃花源风情小镇、二酉山世外桃源文化主题公园、桃源大舞台等八部分组成，集岩溶地质奇观、秦晋农耕文化、土家民俗文化、自然生态文化于一体，浓缩了中国武陵山区最美的原生态自然田园风光，传承着土家族、苗族悠久的人文历史与灿烂的民族文化。,2021-06-07,IP属地：未知
4分 满意,白狐219,酉阳桃花源。“林尽水源，便得一山，山有小口，仿佛若有光。便舍船，从口入。初极狭，才通人。复行数十步，豁然开朗。土地平旷，屋舍俨然，有良田、美池、桑竹之属。阡陌交通，鸡犬相闻。其中往来种作，男女衣着，悉如外人。黄发垂髫，并怡然自乐。”——【晋】陶潜《桃花源记》桃花源，气温15度，耕读传家梦起之处；太极洞，长三公里，穿行其间宛如世外。,2021-05-20,IP属地：未知
4分 满意,288****003,酉阳地处重庆市东南部，武陵山腹地，是重庆幅员面积最大、少数民族人口最多、森林覆盖率最高、平均海拔最高的区县，是重庆唯一不享受高温补贴的区县，是“火炉”重庆名副其实的“凉都”。 “世界上有两个桃花源，一个在您心中，一个在重庆酉阳。”,2019-09-08,IP属地：未知
4分 满意,贵人,桃花源景区包括太古洞和世外桃源两部分，自驾游的朋友要注意了，快到景区时有路标，但是路标一般人看不懂，路标写的全程游客中心和半程游客中心不在一个地方，我们第一次去不明白全程和半程有何区别，导航只到到酉州古城的北门，可是北门不让进就看路标开到半程游客中心，差一点就花100元门票只看世外桃源部分，幸亏问了一下售票员半程和全程的意思，原来是半程（门票也是100）只能看世外桃源不能看太古洞，全程先看太古洞，出来就是世外桃源，此景点个人觉得太古洞比世外桃源更好。100元只看世外桃源太不值了。,2019-05-29,IP属地：未知
4分 满意,珮宝宝,酉阳桃花源是5A景区，景区就在酉阳县城里，到景区还是比较方便的。桃花源景区游览分全程和半程两种，票价不一样。半程只有世外桃源景区，景区内有许多茅屋、农家花园和纪念陶渊明的人文景观，主要营造一种田园风光，四周环山，给人一种宁静悠闲的感觉。太古洞则神奇秀丽，游览步行1小时多，洞内石钟乳形态万千，还有很大的洞内广场，在灯光和地下水映衬下格外绚丽。,2018-10-05,IP属地：未知
4分 满意,罗欢欢欢欢,走了两个多小时的洞·看了一部分没有开完的桃花！感受了这么久最好的一天天气❤️ 嗯 很棒！开车开了六小时！很棒！,2019-03-11,IP属地：未知
5分 超棒,jolin808,非常用心的景点，里面的小吃不贵味道还很好，工作人员都很热情，景色也很漂亮，可惜桃花的花期太短了，没看到，应该种点其他品种的花，让游客一年四季都有花可以赏,2019-10-09,IP属地：未知
3分 不错,豁哥,总的来说，一万七千步，，4000用于逛景色，13000用于太里洞，，，走惨了，，，感觉自己以后不会来了。。主要是累得很，下一站我还要赶去龚滩古镇。我是春节初三去的。桃花没得，，还好有太阳。。,2023-01-24,IP属地：重庆
5分 超棒,wux****ecy,票价便宜，里面真的是世外桃源，和外面对比强烈。夏天进去记得带件外套。不管外面多热，里面很冷。全程走的时间比较长，时间安排需要充足。,2021-09-05,IP属地：未知
4分 满意,320****805,桃花源的自然风光没得说，完全还原了诗词里的场景。很美好！但不得不吐槽桃花源景区的旅游规划，从景区提示牌，到外面的接驳车，配不上A级景区的称号，这点真的需要学习一下濯水景区。别怼，怼还是我对！,2021-07-20,IP属地：未知
5分 超棒,_WeCh****46258,带小朋友去玩的，先觉得怕不好玩，因为不是桃花盛开的季节，结果里面有很多小项目都是小朋友可以参与的，整体走下来小朋友很开心。里面有些农家小吃，个人觉得腊肠不错，其他不推荐。,2019-08-10,IP属地：未知
5分 超棒,lanxiang1215,酉阳桃花源景区位于重庆市酉阳县，包含太古洞和世外桃源，太古洞里有千姿百态的石钟乳，有的像人的手足、有的像动物等等，世外桃源就像人间仙境，值得推荐！,2019-05-02,IP属地：未知
5分 超棒,柏拉图简谱,大美桃花源 酉阳的风景真是美如画 前面已有评价 因为儿童票有优惠 所以单独购买 取票方便 到景区直接凭身份证取票入园 太谷洞真是太漂亮了 可以说是景点的最大亮点,2019-08-17,IP属地：未知
3分 不错,锴kai10,没有宣传上说的那么好，进洞后看到人工造的雾化而形成一个人间仙境；出洞后更感觉到处处都是人造的景点，没有让人太多的惊喜。另外96元的门票实在贵了。,2018-09-21,IP属地：未知
5分 超棒,_M15****8182,酉阳桃花源景区总面积50平方千米，由古桃源、太古洞、酉州古城、桃花源森林公园、桃花源广场、桃花源风情小镇、二酉山世外桃源文化主题公园、桃源大舞台等八部分组成。集岩溶地质奇观、秦晋农耕文化、土家民俗文化、自然生态文化于一体，浓缩了中国武陵山区最美的原生态自然田园风光,2025-05-23,IP属地：贵州
4分 满意,M66****1706,初极狭，然后五彩缤纷！体验包场的感觉！！属于桃花源的淡季，商铺都没有开，但是溶洞还是非常好看，就是3.5公里太难得走了，走在前半程还有新鲜感，后半程就没有那种感觉了，应该是见多了，审美开启疲劳了！总体还是十分好看的,2024-12-20,IP属地：重庆
5分 超棒,1397137,如果是自驾车就在东门进，也就是体育馆这里，没有必要到游客中心，也没有必要到北门停车场。到游客中心就必须坐20元的小火车。,2024-03-25,IP属地：重庆
4分 满意,320****277,酉州古城比较有特色，建议不要在城门口坐电瓶车，自己走着可以在古城里看到很多好看的东西；桃花源将将说得过去，美池那里得穿汉服拍照才合适；太古洞很长，灯光景色好，当年修建的时候不知道有多不容易，就是最后那段直线坡道太长了，建议景区在那段直线坡道旁边增加距离出口多远的提示牌。总的说来这个景区不错，值得一游，点个赞。,2022-10-07,IP属地：重庆
4分 满意,LY牛气冲天,"桃花源景区其实是分成了两个部分，一个按照《桃花源记》打造的景色，另一个是溶洞太古洞。如果你能提前背诵《桃花源记》，那么在游览的过程中你会更有乐趣和代入感。太古洞也十分惊艳，是我见过的最美的溶洞。游完太古洞，是无法原路返回的，因为太古洞全长3.5公里，全程步行需要2.5小时。有些腿脚不好的，时间有限的，就放弃了太古洞这个部分。
另外，还要说说景区的地理位置和购票事宜（见我发的地图）。桃花源景区和酉州古城相连，桃花源景区的入口就在酉州古城的南门，但是南门不能买景区的实体票，实体票只能在北门买。古城南北之间有景区的接驳车，一人2元。",2021-11-06,IP属地：未知
5分 超棒,奥达太平公主,桃花源景区名不虚传，首先可以让小朋友学习桃花源记，每一步都是一句词，然后到村落的地方有很多原始朴素儿童游乐设施，就算是石磨也可以消耗很多能量，走到太古洞就是正式的暴走模式开启3.8公里路程，非常凉快，大人娃儿都加了长袖，最后走得皮打嘴歪，要坐免费大巴车回到北门，再加2块的电瓶车到南门。,2021-10-05,IP属地：未知
4分 满意,M30****8531,自然风景和人文风景都还行，根据陶渊明所作的文章提示去游览，还有一个小溶洞，空气还很不错，就是蚊虫比较多，建议带点驱蚊水，性价比就一般，桃花源外面连接着一个酉阳古城，从酉阳古城到桃花源还有点距离可以坐观光车2元一人，但是我觉得本来这个就是去桃花源为什么门票没有包括观光车呢？还要单独买票，票价有点贵100元一人，反正这种景点大概一生也只去一次吧！,2021-07-07,IP属地：未知
4分 满意,白狐219,#重庆# 5A酉阳桃花源。“林尽水源，便得一山，山有小口，仿佛若有光。便舍船，从口入。初极狭，才通人。复行数十步，豁然开朗。土地平旷，屋舍俨然，有良田、美池、桑竹之属。阡陌交通，鸡犬相闻。其中往来种作，男女衣着，悉如外人。黄发垂髫，并怡然自乐。”——【晋】陶潜《桃花源记》，桃花源，气温15度，国人耕读传家梦起之处；5～12，太极洞，长三公里，穿行其间宛如世外。,2021-05-17,IP属地：未知
5分 超棒,kamala0613,这是进去的时候，票价是75块。有一个地方没有开放。听说那里就要游览两个小时。就说觉得75块的票价不怎么划算。但是进去了之后啦，确实如同。以前课文里讲的那样。真的是别有洞天。感觉跟着诗人意境，一步一步往下走。是一个值得。来一次的地方。毕竟这种学着古人思绪去游览的。经历还是第一次。 还有孩子来说。很。好奇。游览了这事之后，他说如果。还会上这个课的话。他到时候一定会认认真真的把课程完成了。这我也感到很欣慰。体验很好，,2020-08-20,IP属地：未知
4分 满意,M10****391,网上提前一天门票，优惠明显。古城可以利用入住的夜晚游一下，景点建议先游太古洞，然后游桃花源，从上至下走，轻松一点。溶洞特点大，深，灯光布置不错，单就岩溶地貌的演变，与织金洞无法相比。桃花源景点充满隐居田园特色，对于东晋时期的社会环境而言，这样的生活只存在于人们的梦境中。总的景色还是值得一游,2019-08-24,IP属地：未知
3分 不错,M29****8307,买了桃花源和龚滩古镇的2日游套票，5A景区太古洞与桃花源还可以值得一游，全程步行3多个小时，景点有特色，边走边玩轻松，感觉还不错。龚滩古镇真心感到比较失望，怀疑4A景点挂牌的可信度，整个古镇规模不大，只有一条街道可看，进入古镇沿乌江一条道路较窄不足5米，碰巧正在施工塞车、灰尘满天，后悔许多硬件设施正在完善当中，更难以理解的是，景区还好意思收取门票！游走过好几个古镇了，这个景区不值得推荐！后面几张图是龚滩古镇，有点难爬，带小孩和老人家不建议游玩,2019-08-12,IP属地：未知
3分 不错,Ronin天儿,从重庆做了5个小时的火车到酉阳火车站，火车站又做大巴到县城半个多小时，到了县城之后打**，司机就一直跟你讲话故意绕路不开心，差不多又花了半个小时，然而到了之后看到的很心里的落差太大，都是人造景，还要一百块门票不值不值，怪不得来的都是大爷大妈，人也很是稀少不值得花将近七个小时的车程来看一趟，，,2019-03-24,IP属地：未知
